name,animal,description,personality,origin,eating_habits,life_esperance_bottom,life_esperance_top
Eskimo Dog,DOG,"The Eskimo Dog, also known as the American Eskimo Dog, is a beautiful and striking breed. They are medium-sized dogs with a sturdy build and a fluffy double coat that comes in three color varieties - white, biscuit, or white with biscuit markings. Their eyes are dark and almond-shaped, giving them an intelligent and alert expression.

Their triangular ears stand erect on their head, enhancing their attentive and lively appearance. The breed's tail is plumed and curls over their back, adding to their elegant and proud stance.

Eskimo Dogs have a confident and friendly demeanor, making them excellent companions and family pets. They are known for their intelligence, agility, and playfulness, making them great partners for various activities and sports.

Overall, the Eskimo Dog is a stunning breed with a distinctive appearance, loving personality, and endless energy, making them a popular choice for dog lovers around the world.","The Eskimo Dog, also known as the American Eskimo Dog, is a highly intelligent, energetic, and playful breed. They are known for their friendly and affectionate nature, making them great companions for families and individuals alike. Eskimo Dogs are loyal and protective, often forming strong bonds with their owners. They are alert and will bark to alert their owners of any potential danger, making them excellent watchdogs.

This breed is known for their adaptability, thriving in both urban and rural environments as long as they receive plenty of exercise and mental stimulation. Eskimo Dogs are known to be high-energy and require regular exercise to prevent boredom and destructive behaviors. They are highly trainable and eager to please, making them excellent candidates for obedience training and other dog sports.

Eskimo Dogs are social animals and enjoy the company of their human family members. They are known to be good with children and other pets if properly socialized from a young age. Overall, the Eskimo Dog is a loving, loyal, and playful breed that makes an excellent companion for active individuals or families looking for a fun and energetic dog.","The Eskimo Dog, also known as the American Eskimo Dog, is a breed that originated in the United States during the early 20th century. Despite its name, the breed does not have any direct connection with the Eskimo people or the Arctic regions. The breed was developed from various German Spitz-type dogs that were brought to the United States by European immigrants.

The breed's popularity grew rapidly in the early 20th century, and it was first recognized by the American Kennel Club in 1995. The breed is known for its fluffy white coat, compact size, and cheerful and friendly temperament. They are highly intelligent and trainable, making them popular as both companions and working dogs.

Eskimo Dogs are versatile and excel in various activities, including obedience training, agility, and even therapy work. They are known to be alert watchdogs and have a strong loyalty to their families. With proper socialization and training, Eskimo Dogs can be excellent family pets.

Overall, the Eskimo Dog is a charming and affectionate breed that continues to bring joy to families around the world.","The Eskimo Dog is a highly active breed that requires a diet high in protein to support their energy needs. They should be fed a balanced diet of high-quality dog food that is specifically formulated for their size, age, and activity level. It is important to monitor their food intake and adjust portion sizes to prevent obesity, as they have a tendency to overeat. Regular exercise is also essential for this breed to maintain a healthy weight and overall well-being. Additionally, fresh water should be readily available at all times to keep them hydrated. Avoid feeding them table scraps or human foods that may be harmful to their health.",10,15
Flat coated Retriever,DOG,"The Flat-Coated Retriever is a medium to large-sized breed with a long, elegant body and a friendly expression. They have a deep chest, strong legs, and a straight, thick tail. The head is moderately long with a pronounced stop and a slightly square muzzle. Their eyes are dark and expressive, giving off a loving and kind look. The ears are set high on the head and hang close to the cheeks. The coat is flat, dense, and water-resistant, with feathering on the legs and tail. Colors can range from solid black to liver, with some white markings allowed on the chest and toes. Overall, the Flat-Coated Retriever is an athletic and agile dog with a joyful and outgoing personality.","The Flat-Coated Retriever is known for their friendly and cheerful personality. They are outgoing, social, and love being around people and other pets. This breed is highly energetic, playful, and always ready for an adventure. They are extremely affectionate and loyal, making them excellent companions for families. Flat-Coated Retrievers are intelligent and eager to please, making them easy to train. They are known for their boundless enthusiasm and zest for life, always ready to explore and have fun. This breed is gentle, kind-hearted, and patient, making them great with children. However, they can be a bit mischievous and may require proper exercise and mental stimulation to prevent boredom and destructive behaviors. Overall, the Flat-Coated Retriever is a loving, energetic, and sociable breed that brings immense joy and happiness to their families.","The Flat-Coated Retriever originated in England during the mid-19th century as a result of crossing various retriever and spaniel breeds. Initially, they were called ""Wavy-Coated Retrievers"" or ""Smooth-Coated Retrievers"" due to their shiny black coat. The breed was perfected by a man named S. E. Shirley in the late 1800s, who aimed to develop a dog with exceptional retrieving abilities and a friendly, gentle temperament.

Flat-Coated Retrievers were originally bred to assist in retrieving game for hunters, particularly waterfowl. They are known for their excellent swimming skills, strong work ethic, and enthusiasm for fetch. They were recognized by the American Kennel Club in 1915 and have been popular as both hunting companions and family pets ever since.

Flat-Coated Retrievers are intelligent, affectionate, and playful dogs that thrive on human companionship. They are great with children and other pets, making them an excellent choice for families. While they require regular exercise and mental stimulation, they are relatively easy to train due to their eager-to-please nature.

With their happy-go-lucky attitude and graceful appearance, Flat-Coated Retrievers continue to be beloved by dog lovers around the world.","Flat coated Retrievers are known for their hearty appetites and love for food. They have a high energy level and require a diet rich in protein and nutrients to support their active lifestyle. A diet of high-quality dry dog food is recommended, supplemented with fresh fruits and vegetables. It is important to monitor their food intake as they tend to overeat and can easily become overweight. Regular exercise is also crucial to help maintain a healthy weight. Additionally, it is important to provide them with plenty of fresh water to keep them hydrated. Overall, feeding a Flat coated Retriever a balanced diet and ensuring they get enough exercise is key to keeping them healthy and happy.",10,12
French Bulldog,DOG,"The French Bulldog is a small, compact and muscular breed with a sturdy build. They have a distinctive wrinkled face with bat-like ears that stand erect. Their signature short, smooth coat comes in a variety of colors such as brindle, fawn, white, and cream. Frenchies have a flat, pushed-in nose and a prominent underbite, giving them a unique and endearing appearance. They have a short, stocky neck and a corkscrew tail. French Bulldogs have a friendly and expressive face with large, round eyes that convey intelligence and curiosity. Overall, they are charming and adorable dogs with a playful and affectionate nature.","The French Bulldog is known for its charming and affectionate personality. They are friendly, social, and loving dogs that thrive on human companionship. They are playful and have a fun-loving nature, making them great family pets. Despite their small size, French Bulldogs are known for their big personalities and are often referred to as ""clowns"" due to their goofy and entertaining behavior. They are also intelligent and can be stubborn at times, but they respond well to positive reinforcement training. French Bulldogs are generally good with children and other pets, making them a great choice for families. They are loyal and protective, making them excellent watchdogs. Overall, the French Bulldog is a wonderful companion that brings joy and laughter to any home.","The French Bulldog, commonly known as the ""Frenchie,"" originated in France in the 1800s. They were developed as a smaller and more compact version of the English Bulldog, primarily for companionship and as lap dogs for lace workers in Nottingham, England.

When the Industrial Revolution caused many lace workers to immigrate to France, they brought their miniature Bulldogs with them. The dogs were instantly popular among the French elite, including artists and writers. They were especially beloved by members of the Parisian bohemian community.

The breed's popularity continued to grow, and by the late 19th century, French Bulldogs were a fixture in French high society. They were featured in paintings by famous artists such as Toulouse-Lautrec and were even owned by royalty. The American Kennel Club officially recognized the French Bulldog in 1898.

Today, French Bulldogs are one of the most popular dog breeds in the world. They are known for their affectionate and playful nature, as well as their distinctive bat ears and wrinkled faces. Frenchies are adaptable to city or country living and make excellent companions for singles, families, and seniors alike.","French Bulldogs are known to have a healthy appetite and can easily become overweight if their diet is not monitored. They should be fed high-quality, balanced dog food specifically formulated for small breeds. It is important to monitor their food intake as they can be prone to obesity. They should be fed at least twice a day to prevent bloating, as they have a tendency to gulp their food quickly. It is important to avoid feeding them human food as it can upset their stomach and lead to health issues. Additionally, plenty of fresh water should always be available to keep them hydrated.",10,12
German Shepherd,DOG,"The German Shepherd is a medium to large-sized breed known for its strong and muscular build. They typically stand between 22-26 inches tall at the shoulder and weigh between 50-90 pounds. Their coat is dense, double-layered, and usually comes in tan, sable, black, or red with a black mask. They have erect ears and a long, bushy tail. The breed's expressive almond-shaped eyes are usually dark brown in color. German Shepherds are known for their intelligence, loyalty, and versatility, making them excellent working dogs in various fields such as police work, search and rescue, and assistance dogs. They have a confident and noble demeanor, with a regal stance and alert expressions.","The German Shepherd is a loyal, intelligent, and versatile breed known for their protective instincts. They are loyal companions who form strong bonds with their families and are known for their courage and bravery. German Shepherds are highly intelligent and eager to please, making them easily trainable and adaptable to a variety of tasks. They are confident and assertive dogs, with a strong sense of loyalty and devotion to their owners.

German Shepherds are quick learners and excel in obedience training and agility competitions. They are known for their high energy levels and need for regular exercise and mental stimulation. Without proper socialization and training, they may exhibit behaviors such as aggression or anxiety.

Overall, the German Shepherd is a loving and devoted breed that thrives on companionship and purpose. They are well-suited for active individuals or families who can provide them with the attention, exercise, and training they need to thrive.","The German Shepherd breed originated in Germany in the late 19th century. They were initially bred for herding and protecting sheep, but their versatility, intelligence, and loyalty soon made them valuable for other tasks. The breed was developed by a German army captain named Max von Stephanitz, who aimed to create the perfect working dog. He crossed various local herding dogs to develop the breed, including the long-haired German shepherd, resulting in the iconic short-haired breed we know today. German Shepherds became popular in the military and police forces due to their intelligence, trainability, and protective instincts. They gained further popularity in the United States after World War I, where they became widely used as police, search and rescue, and service dogs. Today, German Shepherds are one of the most popular dog breeds worldwide, known for their loyalty, courage, and versatility.","German Shepherds are known for their voracious appetites. They are very active dogs that require a diet high in protein to support their energy levels and muscle development. It is recommended to feed them a balanced diet of high-quality dry kibble formulated for large breeds. 

German Shepherds are prone to obesity, so it is important to monitor their portion sizes and avoid overfeeding. It is also important to provide them with plenty of fresh water to keep them hydrated, especially after periods of exercise.

Some owners choose to feed their German Shepherds a raw diet, which consists of raw meats, bones, fruits, and vegetables. However, it is important to consult with a veterinarian before switching to a raw diet to ensure that it is balanced and meets all of their nutritional needs.

Overall, German Shepherds should be fed a diet that is high in protein, moderate in fat, and low in carbohydrates to keep them healthy and happy.",9,13
German Short haired Pointer,DOG,"The German Shorthaired Pointer is a medium to large-sized breed known for its athletic build and sleek, muscular appearance. They have a short, dense coat that is typically liver, black, or a combination of the two. Their head is well-proportioned with a slightly arched skull and well-defined stop. They have strong jaws and a broad, deep chest. Their ears are set high on the head and hang close to the cheeks. The breed has a long, muscular neck that leads to a deep, well-muscled body. Their tail is typically docked to a medium length and is carried high. Overall, the German Shorthaired Pointer exudes energy and intelligence, making them an excellent choice for active individuals or families.","The German Short haired Pointer is a versatile and energetic breed known for their intelligence, loyalty, and friendly nature. They are highly skilled hunting dogs with a strong instinct to work and please their owners. GSPs are confident, outgoing, and eager to please, making them great family pets. They are affectionate and loving towards their families, but can be wary of strangers. This breed is highly active and requires plenty of exercise and mental stimulation to keep them happy and healthy. They are quick learners and thrive in environments where they can participate in activities such as agility, obedience training, and hunting. Overall, the German Short haired Pointer is a loving, loyal, and energetic breed that makes a great companion for active and outdoorsy families.","The German Short haired Pointer, also known as the GSP, is a versatile hunting dog that originated in Germany in the 19th century. It was created by crossing various breeds such as the Spanish Pointer, English Pointer, and Bloodhound to develop a dog that excelled in both pointing and retrieving game. The GSP was originally used for hunting a wide variety of game, including birds, rabbits, and even deer.

The breed was standardized in the late 19th century and quickly gained popularity among hunters for its intelligence, agility, and strong hunting instincts. The GSP was officially recognized by the American Kennel Club in 1930 and has since become a popular choice for both hunting and as a family pet due to its friendly and loyal nature.

Today, the German Short haired Pointer is still one of the most popular hunting breeds in the world, prized for its versatility and ability to excel in a variety of hunting scenarios. It is known for its strong work ethic, endurance, and ability to work both on land and in water. The GSP is a highly trainable breed that thrives on exercise and mental stimulation, making it an excellent choice for active individuals or families.","The German Short haired Pointer is a high-energy breed that requires a nutrient-rich diet to support their active lifestyle. They should be fed a high-quality dog food that is appropriate for their age, size, and activity level.

These dogs tend to have large appetites, so it's important to monitor their food intake to prevent obesity. Meals should be divided into two or three smaller portions throughout the day to prevent bloat, a serious condition that can be caused by eating too quickly.

German Short haired Pointers are prone to food allergies and sensitivities, so it's important to feed them a diet that is free of common allergens such as grains, soy, and corn. It's also recommended to avoid feeding them table scraps or too many treats, as this can lead to weight gain and nutritional imbalances.

Overall, a balanced diet, regular exercise, and plenty of fresh water are essential for keeping German Short haired Pointers healthy and happy.",10,12
Giant Schnauzer,DOG,"The Giant Schnauzer is a large and powerful dog breed with a sturdy and muscular build. They have a square-shaped body with a deep chest and strong legs. Their head is distinctive with a bushy beard and eyebrows, giving them a dignified and rugged appearance. They have medium-sized, dark, oval-shaped eyes and triangular-shaped ears that stand erect on top of their head. Their thick double coat is wiry and harsh to the touch, with a soft undercoat for extra insulation. Colors include solid black or salt and pepper. Giant Schnauzers have a confident and alert expression, showcasing their intelligence and loyalty.","The Giant Schnauzer is known for its bold, confident, and intelligent personality. They are loyal and protective companions who will fiercely defend their family and territory. They are alert and vigilant, making them excellent guard dogs. Despite their protective nature, they are also affectionate and playful with their loved ones. Giants Schnauzers are energetic and require regular exercise and mental stimulation to prevent boredom and destructive behavior. They are highly trainable and excel in obedience and agility activities. Overall, Giant Schnauzers are loving, loyal, and courageous dogs who make great family pets for experienced dog owners.","The Giant Schnauzer is a large and powerful breed of dog that originated in Germany in the 17th century. They were originally developed as working dogs on farms, tasked with herding livestock and guarding property. The breed was created by crossing standard Schnauzers with larger breeds such as the Great Dane and Bouvier des Flandres.

Giant Schnauzers quickly gained popularity for their intelligence, loyalty, and protective nature. They were also used as police and military dogs due to their courage and strength. The breed was officially recognized by the American Kennel Club in 1930.

Today, Giant Schnauzers are still prized as working dogs, but also make excellent family pets. They are known for being energetic, eager to please, and highly trainable. Their distinctive coat requires regular grooming and they are generally healthy dogs with a lifespan of 10-12 years.","Giant Schnauzers are a large and active breed, so they require a high-quality diet that is rich in protein and other essential nutrients. They should be fed two meals a day to help maintain their energy levels and prevent them from becoming overweight. It is important to monitor their food intake to prevent obesity, as excess weight can put strain on their joints and lead to other health issues.

Giant Schnauzers can be prone to bloat, so it is recommended to feed them smaller, more frequent meals throughout the day rather than one large meal. Wet food can also help prevent bloat as it is easier for them to digest. It is important to avoid feeding them foods that can cause gas, such as beans, cabbage, and dairy products.

Giant Schnauzers are a high-energy breed, so they may require more calories than other dog breeds. It is important to consult with a veterinarian to determine the appropriate amount of food to feed your Giant Schnauzer based on their size, age, and activity level. Additionally, always provide access to fresh water to keep them hydrated throughout the day.",12,15
Golden Retriever,DOG,"The Golden Retriever is a medium to large-sized breed with a friendly, intelligent expression. They have a dense, water-repellent coat that is typically golden in color, with feathering on the legs and tail. Their eyes are dark brown and expressive, and their ears are medium-sized and hang close to the head. Golden Retrievers have a strong, muscular build with a broad head and a medium-length, straight muzzle. They have a straight, level topline and a well-feathered tail that is carried with a slight upward curve. Overall, they have a well-balanced and elegant appearance.","Golden Retrievers are known for their friendly, gentle, and playful nature. They are affectionate dogs that are great with children and other animals. They are intelligent and eager to please, making them easy to train. Golden Retrievers are also very loyal and devoted to their families, often forming strong bonds with their owners. They are energetic and love to be active, enjoying activities such as fetching, swimming, and hiking. Overall, Golden Retrievers are wonderful companions that bring joy and happiness to those around them.","The Golden Retriever breed was developed in Scotland in the mid-19th century by Lord Tweedmouth. He crossed a yellow retriever with a now-extinct breed called the Tweed Water Spaniel, resulting in the Golden Retriever. The breed was initially used as a gun dog to retrieve waterfowl and game during hunting expeditions. Golden Retrievers quickly gained popularity for their friendly and sociable nature, as well as their intelligence and strength. They were officially recognized as a breed by the Kennel Club in England in 1911 and the American Kennel Club in 1925. Today, Golden Retrievers are one of the most popular dog breeds in the world, known for their loyalty, obedience, and versatility in various tasks such as search and rescue, therapy work, and as family pets.","Golden Retrievers are known for their hearty appetites and love of food. They have voracious appetites and can easily overeat if not monitored. It is important to establish a feeding schedule and stick to it to prevent obesity. Recommended feeding amounts vary depending on age, size, and activity level, but typically range from 2-3 cups of high-quality dry dog food per day, divided into two meals.

Golden Retrievers are prone to bloating and gastric torsion, so it is best to avoid free-feeding and instead feed them in smaller, more frequent meals. They should also be discouraged from eating too quickly, as this can lead to digestive issues.

As a large and active breed, Golden Retrievers need a balanced diet that is high in protein and healthy fats. Treats should be given in moderation to avoid weight gain. It is important to provide plenty of fresh water and ensure they have access to water at all times.

Overall, Golden Retrievers are enthusiastic eaters who require a well-rounded, nutritious diet to keep them healthy and happy. Regular exercise is also essential to maintain their overall well-being.",10,12
