name,animal,description,personality,origin,eating_habits,life_esperance_bottom,life_esperance_top
Affenpinscher,DOG,"The Affenpinscher is a small and sturdy breed of dog with a wiry coat that can come in various colors such as black, gray, silver, or red. They have a distinctive monkey-like face with a short muzzle, round eyes, and a pronounced underbite. Their ears are set high on their head and may be cropped or left natural. Affenpinschers have a compact and square body structure with a level back and a high-set tail that is often docked. They are known for their confident and lively personality, with a mischievous expression that matches their playful and curious nature. Overall, the Affenpinscher is a charming and unique breed with a big personality packed into a small package.","The Affenpinscher is a small, alert and lively breed known for its playful and mischievous personality. They are confident, curious and spirited, with a bold and fearless attitude that belies their small size. Affenpinschers are highly intelligent and quick learners, making them easily trainable despite their independent streak. They are also known for their affectionate and loving nature towards their families, often forming strong bonds with their owners. While they can be wary of strangers, they are generally good with children and other pets. Despite their small stature, Affenpinschers have a big personality and a big heart, making them an entertaining and loving companion for the right family.","The Affenpinscher is an ancient breed of toy dog originating from Germany. Believed to have been developed in the 15th century in Central Europe, the Affenpinscher was originally bred to hunt and catch small rodents in homes and stables. Known for their fearless and energetic nature, these dogs were also popular companions of coachmen and stable hands.

The name ""Affenpinscher"" is German for ""monkey-like terrier,"" reflecting the breed's appearance with its distinctive wiry coat and monkey-like facial expression. They were often kept as companion dogs by nobility and were prized for their ability to keep rodents away from the castles and estates.

The Affenpinscher was first recognized as a breed in the late 19th century and quickly gained popularity in Europe, particularly in France and Belgium. They were brought to the United States in the early 20th century and were recognized by the American Kennel Club in 1936.

Today, the Affenpinscher is known for its playful and affectionate nature, making them popular companion dogs and show dogs. They are still prized for their hunting abilities and are often utilized in various dog sports such as agility and obedience competitions. Their unique appearance and personality continue to make them a beloved breed among dog owners worldwide.","Affenpinschers are active and spirited dogs that have a hearty appetite. It is important to feed them high-quality dog food that is formulated for their size and energy level. It is recommended to feed them two meals a day to help regulate their metabolism and prevent overeating. Affenpinschers have a tendency to gain weight easily, so it is important to monitor their portion sizes and not overfeed them. They also enjoy treats, but should be given in moderation to avoid weight gain. Fresh water should always be available for them to stay hydrated. Overall, maintaining a balanced diet and regular exercise routine is key to keeping your Affenpinscher healthy and happy.",12,15
Afghan Hound,DOG,"The Afghan Hound is known for its elegant appearance with long, flowing, silky hair that requires regular grooming. They have a distinct regal bearing with a long, narrow head, almond-shaped eyes, and long, pendulous ears. Their slender, athletic build is complemented by a deep chest and a well-arched loin. The Afghan Hound stands tall with a proud stance and a bushy tail that curls over its back. Their coat comes in a variety of colors including cream, black, blue, and red, often with a striking facial mask. Overall, the Afghan Hound exudes grace and beauty, making them a stunning breed to behold.","The Afghan Hound is known for its regal demeanor and independent nature. They are dignified and aloof, often reserved around strangers but loyal and affectionate with their family. They have a strong prey drive and require regular exercise to channel their energy. Afghan Hounds are intelligent but can be stubborn, requiring consistent training and patience. They are known for their elegant appearance and graceful movements, and have a tendency to chase small animals due to their hunting instincts. Overall, Afghan Hounds are confident, majestic, and somewhat aloof dogs that make loyal companions for those willing to invest time and effort into their care.","The Afghan Hound is an ancient breed with origins dating back thousands of years to the mountainous regions of Afghanistan. These dogs were originally bred by nomadic tribes to assist in hunting large game such as deer, leopards, and even wolves. Known for their speed, agility, and keen sense of sight, the Afghan Hound played a crucial role in helping hunters track and catch prey.

The breed's striking appearance with its long, flowing coat and regal demeanor quickly caught the attention of Westerners in the early 20th century. The first Afghan Hounds were imported to England in the 1920s, where they were introduced to the dog show circuit and quickly gained popularity as a show dog.

Despite their glamorous appearance, Afghan Hounds still retain their hunting instincts and require regular exercise to keep them healthy and happy. They are known for their independent and sometimes aloof nature, as well as their strong prey drive. Afghan Hounds have a unique personality and require a patient and experienced owner who can provide them with the exercise, grooming, and training they need to thrive.","Afghan Hounds are known for being finicky eaters and may have some unique eating habits. They often prefer small, frequent meals throughout the day rather than one large meal. This can help prevent bloating, which is a common issue in deep-chested breeds like the Afghan Hound.

Some Afghan Hounds may be picky eaters and may refuse certain types of food. They may also have a tendency to graze, meaning they will nibble on their food throughout the day rather than eating it all at once. This breed can be sensitive to certain types of food, so it's important to feed them a high-quality diet that is specifically designed for their needs.

Overall, Afghan Hounds require a balanced diet that is high in protein and low in carbs. They may benefit from a diet that includes lean meats, fruits, vegetables, and some grains. Owners should monitor their dog's weight and adjust their diet as needed to maintain a healthy weight. It's also important to provide plenty of fresh water at all times to keep them hydrated.",12,14
African Hunting Dog,DOG,"The African Hunting Dog, also known as the African Wild Dog or Painted Wolf, is a medium-sized canine with unique markings that resemble a colorful, abstract painting. They have a slim, muscular build and distinctive large, rounded ears. Their coat is a mix of yellow, brindle, black, and white patches, with each individual having a unique pattern. African Hunting Dogs have long legs built for running long distances and sharp teeth used for hunting prey. They have a bushy tail that helps with balance while running at high speeds. Overall, these dogs are highly social, intelligent, and skilled hunters in the wild.","The African Hunting Dog, also known as the African Wild Dog, is a highly social and intelligent breed with a unique personality. They are known for their strong pack mentality and cooperative hunting techniques. These dogs are very energetic and require plenty of exercise to keep them mentally stimulated and prevent boredom. They are also very playful and enjoy interacting with their human companions.

Despite their wild hunting instincts, African Hunting Dogs are generally friendly and gentle towards humans. They are known for their loyalty and strong bond with their pack members. However, they can be wary of strangers and may exhibit protective behaviors towards their family.

These dogs are highly social and thrive in environments where they can interact with other dogs. They are excellent communicators and use a combination of vocalizations, body language, and facial expressions to convey their emotions and intentions.

Overall, African Hunting Dogs are intelligent, energetic, social, and loyal companions that require a dedicated owner willing to provide plenty of exercise and mental stimulation to keep them happy and healthy.","The African Hunting Dog, also known as the African Wild Dog or Painted Wolf, is a species of canid native to sub-Saharan Africa. They are highly efficient predators, known for their incredible stamina and teamwork when hunting prey. 

African Hunting Dogs are one of the most endangered carnivores in Africa, with estimates suggesting only around 6,000 individuals left in the wild. They have suffered due to habitat loss, disease, and conflicts with humans.

These dogs have a unique appearance, with their colorful coat patterns and large rounded ears. They live in packs, usually consisting of around 6 to 20 individuals, led by an alpha pair that dominates breeding.

Their origins can be traced back to the earliest canids in Africa, with some fossil evidence suggesting they have been around for over 5 million years. They are not closely related to domestic dogs, and are considered a distinct species.

African Hunting Dogs are vital to the ecosystems in which they live, helping to control prey populations and shaping the landscape. Conservation efforts are underway to protect these incredible animals and ensure their survival for future generations.","The African Hunting Dog, also known as the African wild dog, is a highly social and cooperative carnivore that primarily feeds on large ungulates such as antelopes and wildebeests. They are skilled hunters that use teamwork to take down prey, with each member of the pack playing a specific role in the hunt.

These dogs have a high metabolism and need to consume a significant amount of food to sustain their energy levels. They typically hunt in the early morning and late afternoon when the weather is cooler, and they have a better chance of catching prey.

African Hunting Dogs have a specialized hunting technique that involves chasing down their prey over long distances until the animal becomes exhausted. They have sharp teeth and powerful jaws that help them tear apart their prey and consume it quickly before other predators arrive.

In addition to large ungulates, African Hunting Dogs may also feed on smaller mammals, birds, and even insects if larger prey is scarce. They are opportunistic feeders and will eat whatever is available to them in their environment.

Overall, African Hunting Dogs have a high protein diet that is essential for their active and energetic lifestyle. They are skilled hunters that work together as a team to secure their food sources and ensure the survival of their pack.",10,12
Airedale,DOG,"The Airedale terrier is a large and athletic breed with a sturdy build. They have a wiry and dense coat that is typically tan with a black saddle. Their bushy eyebrows and beard give them a distinctive and intelligent expression. Airedales have a long head with a slight stop and a strong jaw. Their ears are v-shaped and fold over at the tips. They have a deep chest and straight, powerful legs. Airedales have a tail that is typically docked and carried high. Overall, they have a confident and alert demeanor, making them excellent working dogs and loyal companions.","The Airedale Terrier is known for being confident, intelligent, and independent. They are a spirited and energetic breed with a playful and mischievous side. Airedales are highly trainable and excel in obedience and agility activities. They are loyal and protective of their families, making them great guard dogs. Airedales are also known for their friendly and outgoing nature, getting along well with children and other pets. However, they can be stubborn and willful at times, so consistent training and socialization are key. Overall, the Airedale Terrier is a loving and affectionate breed with a strong personality.","The Airedale Terrier, also known as the ""King of Terriers,"" originated in the 19th century in the Aire Valley of Yorkshire, England. The breed was developed by crossing the Otterhound and Black and Tan Terrier to create a versatile hunting and working dog. Airedales were originally bred to hunt otters and rats, as well as to assist in hunting large game like deer and boar.

The breed quickly gained popularity as a skilled hunting dog and loyal companion, known for their intelligence, courage, and versatility. Airedales were also used during World War I as messenger dogs, guard dogs, and search and rescue dogs.

In addition to their hunting and working abilities, Airedales became popular as family pets due to their friendly and affectionate nature. They are known for their playful and energetic personalities, as well as their protective instincts towards their families.

Today, Airedales are still used for hunting and working purposes, as well as participating in dog sports like agility and obedience trials. They are also popular as therapy and service dogs due to their intelligence and trainability. The Airedale Terrier remains a beloved breed for their loyalty, versatility, and charming personality.","The Airedale Terrier is a breed known for its hearty appetite and active nature. These dogs have a healthy appetite and should be fed a high-quality dog food that meets their nutritional needs based on their age, size, and activity level. 

They are energetic and active dogs that require a diet rich in protein to support their muscle development and energy levels. It is recommended to feed them two meals a day to prevent bloating and maintain their energy levels throughout the day.

Airedales should not be free-fed as they tend to overeat, leading to obesity. It is important to monitor their food intake and ensure they are not becoming overweight. They should also have access to fresh water at all times to keep them hydrated, especially during periods of high activity.

Overall, the Airedale Terrier should be fed a balanced diet of high-quality dog food, given in appropriate portions to maintain a healthy weight and energy level for this active breed.",10,13
American Staffordshire Terrier,DOG,"The American Staffordshire Terrier is a strong, muscular breed with a large head and powerful jaw. They have a broad chest and straight, strong legs. Their coat is short and stiff, and can come in a variety of colors including black, blue, red, and brindle. They have a distinctive ""bully"" look with a wide, flat skull and wide-set eyes. Their ears are typically cropped, but can also be left natural. American Staffordshire Terriers have a confident and alert expression, and are known for their loyalty and protective nature. They are medium-sized dogs, with males typically weighing between 55-70 pounds and females weighing between 40-55 pounds.","The American Staffordshire Terrier is a confident, intelligent, and loyal breed known for their strong and muscular build. They are highly energetic and thrive on physical activity and mental stimulation. These dogs are affectionate and loving towards their families, often forming strong bonds with their owners. They are great with children and can be protective of their family, making them excellent guard dogs. While they are often misunderstood due to their reputation, American Staffordshire Terriers are friendly and sociable when properly trained and socialized. They require firm leadership and consistent training to help channel their energy in a positive way. Overall, the American Staffordshire Terrier is a loyal companion that displays courage, tenacity, and a playful spirit.","The American Staffordshire Terrier, also known as the Amstaff, has its origins in 19th century England. They were originally bred for bull-baiting and bear-baiting, but when these blood sports were banned in England, the dogs were brought to America where they were selectively bred for their courage, strength, and loyalty.

The breed was officially recognized by the American Kennel Club in 1936 as the American Staffordshire Terrier to distinguish it from the smaller Staffordshire Bull Terrier. The Amstaff became popular in the United States for its versatility, intelligence, and athleticism.

While the American Staffordshire Terrier shares a similar appearance to the American Pit Bull Terrier, they are considered separate breeds with distinct characteristics. The Amstaff is known for being friendly, confident, and good-natured, making them excellent family pets and loyal companions.

Today, the American Staffordshire Terrier is a beloved breed known for its protective nature and affectionate demeanor. They excel in various dog sports, such as agility and obedience, and are valued for their strong bond with their owners.","American Staffordshire Terriers, like most dogs, are carnivorous and require a diet rich in animal-based proteins. They should be fed high-quality commercial dog food or a balanced homemade diet that includes lean meats, vegetables, and fruits. It is important to monitor their food intake as they are prone to obesity. The recommended daily feeding amount for an adult AmStaff is 1.5 to 2.5 cups of dry kibble divided into two meals. They should have access to fresh water at all times and treats should be given in moderation to prevent weight gain. It is essential to consult with a veterinarian to determine the best diet plan for your American Staffordshire Terrier based on their age, weight, and activity level.",12,16
Appenzeller,DOG,"The Appenzeller is a medium-sized dog with a sturdy build and powerful musculature. They have a compact body with a deep chest, straight back, and well-set tail. Their head is proportional to their body, with a slightly domed skull and medium length muzzle. They have dark, almond-shaped eyes that convey intelligence and alertness. The breed's ears are medium-sized and triangular, often held erect or semi-erect. Their coat is short, dense, and weather-resistant, with a distinctive tricolor pattern of black, tan, and white markings. The Appenzeller's confident and energetic demeanor reflects their history as a versatile working dog.","The Appenzeller Sennenhund is a spirited, energetic, and intelligent breed of dog with a playful and affectionate personality. They are known for their high levels of energy and endurance, making them well-suited for active families or individuals who enjoy outdoor activities. Appenzellers are also highly loyal and protective of their families, making them excellent watchdogs. They are independent thinkers and may be somewhat stubborn, so early and consistent training is essential. While they are generally friendly and sociable, they may be reserved or wary of strangers. Overall, the Appenzeller is a loving and devoted companion with a strong work ethic and a lively spirit.","The Appenzeller is a Swiss mountain dog that originated in the Appenzell region of Switzerland. They were bred as herding dogs by the Swiss farmers to help drive and protect their livestock. This breed is one of the four ancient Swiss mountain dog breeds, the others being the Bernese Mountain Dog, the Greater Swiss Mountain Dog, and the Entlebucher Mountain Dog.

The Appenzeller is known for its intelligence, agility, and strong work ethic. They are highly energetic and require plenty of exercise and mental stimulation. They are also loyal, protective, and make excellent watchdogs. The breed's distinctive tricolor coat, which consists of a black base with tan and white markings, helps them blend in with their surroundings while herding in the mountains.

Despite their strong working drive, the Appenzeller is also a loving and affectionate family dog. They are great with children and other pets, and are always eager to please their owners. The breed is relatively rare outside of Switzerland, but has gained popularity in recent years for their versatility and loyalty.","The Appenzeller dog breed is known for their high energy levels and need for physical activity. Due to their active nature, they have hearty appetites and require a balanced diet to maintain their muscle mass and overall health. It is recommended to feed them high-quality, protein-rich dog food specifically tailored for active breeds. Appenzellers should be fed twice a day to meet their caloric needs and prevent obesity. Treats should be given sparingly to avoid weight gain. Due to their sensitivity to certain food ingredients, owners should be cautious of any allergies or intolerances their dog may have. Adequate hydration is crucial, especially during periods of heavy exercise. Consulting with a veterinarian or pet nutritionist can help tailor a diet plan to meet the specific needs of an Appenzeller dog.",13,15
Australian Terrier,DOG,"The Australian Terrier is a small, sturdy breed with a compact and balanced build. They typically stand around 10-11 inches tall and weigh between 14-16 pounds. Their coat is rough and harsh with a soft undercoat, and comes in shades of blue and tan, solid red, or sandy. The breed has a distinct ruff around their neck and a topknot of soft fur on their head. Australian Terriers have small, V-shaped ears that stand erect on top of their head, and dark, oval-shaped eyes that give them an intelligent expression. They have a straight, medium-length tail that is carried erect and is usually docked to a short length. Overall, the Australian Terrier is a sturdy, alert, and lively breed known for its loyalty and protective nature.","The Australian Terrier is known for being a spirited, alert, and lively breed. They are courageous and confident dogs with a strong sense of loyalty and devotion to their family. Despite their small size, they are fearless and make excellent watchdogs. They are independent thinkers and can be somewhat stubborn, but they are also intelligent and eager to please their owners. Australian Terriers are friendly and social dogs that get along well with children and other pets, but they may be wary of strangers. They have a playful and mischievous nature, and they thrive on regular exercise and mental stimulation. Overall, Australian Terriers are charming, affectionate, and energetic companions.","The Australian Terrier is a small breed of dog that originated in Australia during the 19th century. They were bred to be versatile working dogs on farms, able to hunt small game and also act as watchdogs. The breed is thought to have been developed from a mix of British terriers, including the Cairn Terrier and Dandie Dinmont Terrier, that were brought to Australia by early European settlers.

The Australian Terrier quickly gained popularity for their intelligence, loyalty, and adaptability. They were used to control vermin on farms, as well as to protect livestock from predators. The breed is known for their high energy levels, bold personality, and strong prey drive. They are also valued for their affectionate nature and love of human companionship.

The Australian Terrier was officially recognized as a breed by the Australian National Kennel Council in 1933. They were also recognized by the American Kennel Club in 1960. Today, Australian Terriers are kept as beloved family pets and excel in various dog sports, including agility and obedience trials. Despite being a relatively rare breed, they continue to be highly regarded for their intelligence, loyalty, and playful demeanor.","The Australian Terrier is a small and active breed that requires a balanced diet to maintain its energy levels and overall health. They should be fed high-quality dog food that is appropriate for their age, size, and activity level. It is important to monitor their intake to prevent obesity, as they have a tendency to gain weight easily.

Daily portions should be divided into two meals to avoid overeating and digestive issues. Treats should be given in moderation to prevent weight gain and maintain proper dental health. Fresh water should always be available to keep them hydrated.

This breed enjoys regular exercise, so it is important to incorporate daily walks, playtime, and mental stimulation to keep them physically and mentally healthy. With the right diet and exercise routine, the Australian Terrier can lead a long and happy life.",12,15
