name,animal,description,personality,origin,eating_habits,life_esperance_bottom,life_esperance_top
Pekinese,DOG,"The Pekingese is a small toy breed of dog known for its distinctive appearance. They have a compact and sturdy body with a flat face, prominent large eyes, and a distinctive mane of hair around their neck. Their ears are heart-shaped and set high on their head, giving them an alert and expressive look. Pekingese have a long, flowing coat that requires regular grooming to prevent matting. They come in a variety of colors, including gold, red, black, and white. Despite their small size, Pekingese are known for their confident and independent personalities. They are playful, affectionate, and loyal companions that make great lap dogs.","The Pekingese is a small but dignified toy breed known for their confident and independent personality. They are affectionate and loyal to their family, but can also be stubborn and strong-willed. Pekingese are often described as regal and proud, with a tendency to act like royalty. They are alert and cautious around strangers, making them good watchdogs. Despite their small size, they are brave and will stand their ground when they feel threatened. Pekingese are also known for their sense of humor and playful nature, making them charming companions. While they can be high maintenance in terms of grooming and training, their unique personality and endearing qualities make them a popular breed among dog lovers.","The Pekingese breed of dog originated in ancient China, where they were bred as companions for royalty and nobility. They were highly prized and often given as gifts to foreign dignitaries. The breed was named after the city of Beijing, which was formerly known as Peking.

Pekingese dogs were considered sacred and were not allowed to leave the palace grounds. They were specifically bred to resemble lions, which were symbolic creatures in Chinese mythology. The breed's distinctive flat face and mane-like coat were meant to resemble the mythical lion.

During the Qing Dynasty in the 19th century, the breed faced near extinction as the imperial family fell from power. However, several Pekingese were smuggled out of China by Westerners, primarily British soldiers, and brought to England. The breed was officially recognized by the American Kennel Club in 1906.

Today, Pekingese dogs are still considered loyal and affectionate companions. They are known for their independent nature and regal appearance. Despite their long history, the breed remains relatively rare and is prized by dog enthusiasts around the world.","Pekingese dogs are known for their small size and big personalities. In terms of eating habits, Pekingese are generally good eaters and are known to have a hearty appetite. They should be fed a high-quality dog food that is appropriate for their age, size, and activity level. It is important to feed them small, frequent meals throughout the day as they are prone to obesity due to their small size and tendency to gain weight easily. It is also important to monitor their weight and adjust their food intake accordingly. Additionally, Pekingese should not be overfed as they are susceptible to obesity-related health issues. It is important to provide them with fresh water at all times and to avoid giving them table scraps or human food, as it can lead to digestive issues. Overall, Pekingese dogs should be fed a balanced diet and their feeding habits should be monitored closely to ensure they maintain a healthy weight and overall well-being.",12,15
Pembroke,DOG,"The Pembroke Welsh Corgi is a small to medium-sized dog with a sturdy build and a long body. They have a foxy, intelligent expression with large, erect ears and a short, docked tail. Their coat is dense and weather-resistant, coming in various colors including red, sable, and tricolor. This breed typically stands between 10-12 inches tall at the shoulder and weighs between 25-30 pounds. Overall, Pembroke Welsh Corgis are known for their playful, alert, and affectionate personalities.","The Pembroke Welsh Corgi is an intelligent, friendly, and affectionate breed known for their playful and outgoing nature. They are highly social animals, enjoying the company of their human family members and other pets. Corgis are also loyal and protective, making them great watchdogs. They are known for their high energy levels and love to be involved in activities with their owners, such as hiking, running, or playing fetch. Despite their small size, they have a big personality and are often described as bold and confident. Corgis are also known for their stubborn streak, but with proper training and socialization, they can be well-behaved and obedient companions.","The Pembroke Welsh Corgi is a small herding dog breed with origins dating back to 10th century Wales. They are believed to have descended from the Swedish Vallhund dogs that were brought to Wales by the Vikings. The breed was favored by Welsh farmers for their herding abilities, particularly with cattle.

The Pembroke Welsh Corgi is named after Pembrokeshire, a county in Wales where they were widely used as working dogs. They are known for their low stature, long body, and perky ears. Queen Elizabeth II is a famous owner and has helped to popularize the breed.

Pembrokes are intelligent, affectionate, and energetic dogs that require regular exercise and mental stimulation. They are also known for their playful nature and love of companionship. Today, Pembroke Welsh Corgis are popular as family pets, agility competitors, and therapy dogs.","Pembroke Welsh Corgis are known for their love of food and can be prone to obesity if not monitored carefully. It is important to feed them a balanced diet that is appropriate for their age, size, and activity level. This breed should be fed small meals throughout the day to prevent bloating and other digestive issues. Avoid overfeeding or giving them too many treats, as they are known for their begging behavior. It is also important to provide plenty of exercise to keep them at a healthy weight. Regular veterinary check-ups to monitor their weight and overall health are essential.",12,15
Pomeranian,DOG,"The Pomeranian is a small, fluffy toy breed known for its thick double coat, compact build, and fox-like face. They typically weigh between 3-7 pounds and stand around 6-7 inches tall at the shoulder. Their coat comes in a variety of colors including orange, black, white, cream, and sable. Pomeranians have a short, compact body with a curled tail that is held high over their back. Their ears are small and perky, while their eyes are dark and expressive. Overall, Pomeranians have a vibrant and alert appearance, with a confident and outgoing personality to match.","Pomeranians are small yet confident dogs with big personalities. They are known for their lively and spirited demeanor, often displaying a bold and playful attitude. Despite their small size, Pomeranians are fearless, alert, and outgoing. They are extremely loyal to their owners and enjoy being the center of attention.

Pomeranians are intelligent and eager to please, making them relatively easy to train. However, they can have a stubborn streak and may need consistent and patient training. They are social dogs that enjoy being around people and other animals, but they can be wary of strangers and may take some time to warm up to new people.

Pomeranians are energetic and require regular exercise and mental stimulation to prevent boredom and destructive behavior. Despite their small size, they have a lot of energy and love to play and explore. They are also known for their cheerful and friendly nature, making them excellent companions for people of all ages.

Overall, Pomeranians are affectionate, loyal, and feisty dogs that bring a lot of joy and entertainment to their owners. They have a big personality in a small package and are sure to leave a lasting impression on anyone they meet.","The Pomeranian breed is believed to have originated in the region of Pomerania, which is now part of modern-day Poland and Germany. They were descendants of the larger Spitz-type dogs that were popular in the region. Pomeranians were originally bred as working dogs, primarily as sled dogs or sheep herders.

In the 18th century, Queen Victoria became enamored with the breed, leading to their rise in popularity as companions and show dogs. Queen Victoria even owned a smaller version of the breed, leading to the miniaturization of the Pomeranian we see today.

Pomeranians were officially recognized by the American Kennel Club in 1888. They are known for their fluffy coats, perky ears, and lively personalities. Despite their small size, Pomeranians are known for being alert, intelligent, and bold dogs.

Today, the Pomeranian breed is still beloved for its charming personality and glamorous appearance, making them a popular choice for dog owners around the world.","Pomeranians are small dogs with hearty appetites, so owners should monitor their food intake to prevent obesity. It is recommended to feed them a high-quality, small-breed specific dog food to meet their nutritional needs. Pomeranians typically do well on a diet that is high in protein and low in carbohydrates.

They have a fast metabolism and may require frequent small meals throughout the day to maintain their energy levels. Owners should monitor their weight and adjust their portion sizes accordingly.

Pomeranians are known to be picky eaters, so it may be necessary to experiment with different types of food to find what they prefer. It is important to avoid feeding them table scraps or human foods, as it can upset their stomach and lead to obesity.

Overall, Pomeranians thrive on a balanced diet that meets their specific needs as a small breed dog. Owners should consult with their veterinarian to determine the best feeding plan for their individual dog.",12,16
Pug,DOG,"Pugs are small, sturdy dogs with a square, compact body and a distinctive wrinkled face. They have a short, smooth coat that comes in various colors such as fawn, black, and silver. Their head is large and round with a short, wrinkled muzzle and a signature black mask on their face. Pugs have dark, round eyes that give them an expression of charm and curiosity. Their ears are small and folded over, adding to their adorable appearance. The breed typically weighs between 14-18 pounds and stands around 10-13 inches tall at the shoulder. Pugs have a friendly and affectionate personality, making them popular companion pets.","Pugs are known for their charming, affectionate, and playful personalities. They are sociable and love being around people, making them great family pets. Despite their small size, they are known for their big personalities and are often described as clownish and comical. Pugs are loyal and devoted to their owners, forming strong bonds with them. They are also known for their stubborn streak, but their sweet nature usually makes up for it. Pugs are adaptable dogs that can thrive in various living situations, making them great companions for both city dwellers and suburban families. Overall, pugs are loving, friendly, and cheerful dogs that bring joy to the lives of their owners.","The Pug is an ancient breed with origins dating back to at least 400 BC in China. It is believed to have been bred by the Chinese nobility, specifically by the ruling families of the Han dynasty. Pugs were highly esteemed and were often kept as royal companions. The breed made its way to Europe in the 16th century through trading routes established by the Dutch East India Company.

Pugs became popular among European royalty, including the House of Orange in the Netherlands. In the 18th century, the breed gained favor in England through Queen Victoria, who was a renowned Pug enthusiast. The breed also became popular in other European countries during this time.

Pugs were officially recognized by the American Kennel Club in 1885 and have since become a beloved breed in the United States. They are known for their friendly and affectionate nature, as well as their distinctive features, including their wrinkled faces, curled tails, and unique ""mop"" ears.

Today, Pugs are a popular companion breed worldwide, cherished for their playful personalities and loyalty to their families. They are often referred to as ""clowns"" due to their comical and entertaining nature. Despite their small size, Pugs have big personalities and are adored by dog lovers everywhere.","Pugs are known for their love of food and can be prone to overeating if not monitored carefully. It is important to establish a feeding schedule and stick to it to prevent obesity. Pugs typically require a high-quality diet that is rich in protein and low in fat to maintain a healthy weight. They should be fed twice a day with appropriate portion sizes based on their age, weight, and activity level. Additionally, pugs should not be fed table scraps or human food as it can lead to digestive issues and weight gain. It is crucial to provide fresh water at all times to keep them hydrated. Overall, pugs should be fed a balanced diet in moderation to keep them healthy and happy.",12,15
Redbone,DOG,"The Redbone Coonhound is a medium to large-sized breed known for its striking red coat and gentle expression. They have a muscular build, with a strong and deep chest, sturdy legs, and a high-set tail that curves slightly upwards. Their head is proportionate to their body, with a broad skull, long ears that hang down to their jawline, and large, expressive eyes. Redbones have a keen sense of smell and a melodious bay that they use when hunting or tracking. Overall, they are graceful and athletic dogs with a friendly and outgoing personality.","Redbone Coonhounds are known for their passionate and driven personality. They are bred to be hunting dogs and have a strong prey drive, so they are highly energetic and require plenty of exercise. Despite their intensity while on the hunt, Redbones are also known for being gentle and affectionate. They are loyal companions who are eager to please their owners. Redbones are intelligent and can be stubborn at times, so consistent training is important. They are social dogs and generally get along well with other pets and children. Overall, the Redbone Coonhound is a loving and devoted breed that thrives in an active and structured environment.","The Redbone Coonhound is a breed of dog that originated in the United States. It is believed that the breed was developed in the Southern United States in the late 18th and early 19th centuries by crossing Bloodhounds, Black and Tan Coonhounds, and Foxhounds. The breed was named after Peter Redbone, an early breeder of the dogs.

Redbone Coonhounds were originally bred for hunting raccoons and other small game. They are known for their exceptional tracking abilities, endurance, and determination in pursuing their prey. The breed quickly gained popularity among hunters in the American South due to its keen sense of smell and agility in the field.

Redbone Coonhounds are medium to large-sized dogs with a striking red coat and floppy ears. They are known for their friendly and outgoing temperament, making them excellent family pets. The breed is also highly intelligent and trainable, but they require regular exercise and mental stimulation to prevent boredom.

Today, Redbone Coonhounds are still used for hunting, but they also excel in various dog sports and activities such as tracking, obedience, and agility. They are beloved for their loyalty and affection towards their owners, making them a popular choice for families and active individuals alike.","The Redbone Coonhound is a hunting dog breed known for its high energy and endurance levels. They have voracious appetites due to their active lifestyle and will need a diet that provides them with plenty of protein and calories to sustain their energy levels. 

It is important to feed Redbone Coonhounds high-quality dog food that is specially formulated for active breeds. They thrive on a diet rich in lean proteins such as chicken, turkey, or fish, as well as healthy fats to support their skin and coat health. 

Redbones can be prone to obesity, so it is crucial to monitor their portion sizes and avoid overfeeding. They should be fed two to three meals a day to prevent bloating and maintain their energy levels throughout the day. 

Overall, the eating habits of Redbone Coonhounds should focus on providing them with a well-balanced diet that meets their high-energy requirements and supports their health and wellbeing.",10,12
Rhodesian Ridgeback,DOG,"The Rhodesian Ridgeback is a large and muscular breed of dog with a distinctive ridge of hair along its back that runs in the opposite direction of the rest of its coat. They have a sleek, athletic build and a deep chest. Their head is broad and flat, with a powerful jaw and expressive round eyes. The ears are medium-sized and set high on the head, hanging down close to the cheeks. Their coat is short and dense, ranging in color from light wheaten to red wheaten. Overall, the Rhodesian Ridgeback exudes strength, elegance, and athleticism. They typically stand between 24-27 inches tall at the shoulder and weigh between 70-85 pounds.","The Rhodesian Ridgeback is a breed known for their loyalty, intelligence, and protective nature. They are strong and muscular dogs with a confident and independent personality. They are known for their hunting instincts and fierce loyalty to their families. Despite their protective nature, they are gentle and loving with children and make great family pets. They are also extremely intelligent and responsive, making them easy to train. Rhodesian Ridgebacks are known for their independence and can be somewhat stubborn at times, requiring consistent and firm training. Overall, they are a loving and devoted breed that thrives on companionship and exercise.","The Rhodesian Ridgeback is a breed of dog that originated in Southern Africa, specifically in present-day Zimbabwe. It was originally bred by indigenous Khoikhoi people and European settlers in the 18th and 19th centuries for hunting and guarding purposes. The breed was further developed by missionaries and big game hunters who needed a versatile and loyal hunting companion in the African bush. 

The Rhodesian Ridgeback gets its name from the distinctive ridge of hair along its back that grows in the opposite direction of the rest of its coat. This ridge is a result of a genetic mutation passed down from the Khoikhoi dogs that were originally crossed with European breeds.

Throughout history, Rhodesian Ridgebacks have been used for hunting large game such as lions, making them known for their bravery and tenacity. They are also valued for their loyalty and protective nature, making them excellent guard dogs for families and property.

Today, Rhodesian Ridgebacks are popular pets and show dogs around the world, known for their athleticism, intelligence, and loving temperament. The breed was officially recognized by the American Kennel Club in 1955.","Rhodesian Ridgebacks are known for their strong hunting instincts and high energy levels, so they require a diet that is rich in protein and balanced in nutrients. It is important to feed them high-quality dog food that is specifically formulated for large, athletic breeds.

They should be fed at least two meals a day to maintain their energy levels and satisfy their hunger. It is important to monitor their weight and adjust their portions as needed, as they are prone to obesity if overfed.

Ridgebacks have sensitive stomachs, so it is important to avoid feeding them table scraps or high-fat foods that could upset their digestive system. They also have a tendency to gulp their food, so feeding them smaller, more frequent meals or using a slow feeder bowl can help prevent bloating and other digestive issues.

Overall, Rhodesian Ridgebacks thrive on a diet that is high in protein, moderate in fat, and low in carbohydrates, with plenty of fresh water available at all times. Consulting with a veterinarian to determine the best diet for your specific dog is recommended.",10,12
Rottweiler,DOG,"The Rottweiler is a large, robust breed with a muscular build and a confident appearance. They have a broad head with a strong jaw and large, triangular ears that hang down. Their eyes are dark and expressive, usually with a serious and alert expression. The Rottweiler's coat is short, dense, and double-layered, with a black base and distinct rust markings on their cheeks, legs, and chest. They have a thick neck and strong, straight back, with a tail that is traditionally docked. Rottweilers have a powerful, yet agile gait and are known for their protective nature and loyalty to their families.","The Rottweiler is a confident, loyal, and powerful breed of dog. They are known for their protective nature and make excellent guard dogs. Despite their intimidating appearance, they are loving and devoted to their family. Rottweilers are highly intelligent and trainable, but require a firm and consistent hand in training. They are known to be aloof with strangers, but once they form a bond with their family, they are affectionate and loving companions. Rottweilers are active and need plenty of exercise to stay happy and healthy. Overall, they are a versatile and devoted breed, making them a popular choice for families looking for a loyal and protective pet.","The Rottweiler is a breed of domestic dog, known for its strength, intelligence, and loyalty. Originating in the town of Rottweil, Germany, the breed's history can be traced back to Roman times when they were used to herd livestock and pull carts. 

The Rottweiler's ancestors were likely the drover dogs that accompanied the Roman legions as they moved across Europe. These dogs were eventually bred with local dogs in Rottweil, resulting in the modern-day Rottweiler breed. 

Throughout the centuries, Rottweilers were used as working dogs in various capacities, such as herding, cart pulling, and guarding. Their strong build and protective nature made them ideal for these tasks. 

In the early 20th century, the Rottweiler breed almost faced extinction due to the decline in demand for working dogs. However, efforts by dedicated breeders helped revive the breed's popularity, and they were officially recognized by the American Kennel Club in 1931. 

Today, Rottweilers are one of the most popular dog breeds in the world, valued for their versatility, intelligence, and loyalty. They continue to excel in various roles, including as family pets, therapy dogs, and service animals.","Rottweilers are known to have hearty appetites and enjoy eating, which can lead to overeating and weight gain if not monitored. It is important to establish a regular feeding schedule to prevent obesity. They do well on a high-quality diet that is rich in protein and essential nutrients. It is recommended to divide their daily food into two meals to prevent bloat, a potentially life-threatening condition. Due to their strong jaws, they may benefit from chew toys or dental chews to help keep their teeth clean and healthy. Overall, Rottweilers have healthy appetites but require moderation and balanced nutrition to maintain their health.",8,12
