name,animal,description,personality,origin,eating_habits,life_esperance_bottom,life_esperance_top
Affenpinscher,DOG,"The Affenpinscher is a small breed of dog with a sturdy and compact build. They typically stand about 9-11 inches tall at the shoulder and weigh between 7-10 pounds. Their coat is rough and wiry, with a longer fringe of hair on the face that gives them a distinctive monkey-like appearance. Their coat color can range from black, gray, silver, or red. They have a short muzzle with a pronounced underbite, rounded eyes, and erect ears that are set high on the head. Overall, the Affenpinscher has a charming and mischievous expression that is full of personality.","The Affenpinscher is a small, lively, and confident dog breed known for its lively and mischievous personality. They are intelligent, curious, and always eager to explore their surroundings. Affenpinschers are very loyal and devoted to their owners, often forming strong bonds with their family members. They have a playful and energetic nature, and love to engage in activities that challenge their intelligence and agility. Despite their small size, Affenpinschers are brave and will not hesitate to protect their loved ones if they feel threatened. They can be stubborn at times, but with consistent training and positive reinforcement, they can be well-behaved and obedient companions. Overall, Affenpinschers are charming, affectionate, and full of personality, making them a delightful addition to any home.","The Affenpinscher is a small breed of dog that originated in Germany in the 17th century. The name ""Affenpinscher"" translates to ""monkey-like terrier"" in German, reflecting the breed's distinctive appearance with a cute and mischievous monkey-like face. These dogs were originally bred to be ratters, hunting and catching small rodents in homes and barns.

The Affenpinscher is believed to be related to other toy breeds such as the Brussels Griffon and the Miniature Schnauzer. They were popular among noble families in Germany and France in the 19th century, often kept as lap dogs and companions.

Despite their small size, Affenpinschers are known for their fearless and feisty personality. They are playful, intelligent and possess a strong independent streak. They have a wiry coat that comes in various colors, including black, gray, and red. Affenpinschers also have a distinctive beard and mustache, giving them a unique and charming appearance.

Today, Affenpinschers are popular companion dogs known for their lively and affectionate nature. They excel in various dog sports and activities, including obedience training and agility. Their quirky personality and distinctive looks have endeared them to dog lovers around the world.","The Affenpinscher is a small, toy breed dog that tends to have good appetites. They are known to be enthusiastic eaters and may overeat if given the chance, so it's important to monitor their food intake closely. It is recommended to feed them a high-quality, small breed dog food that is appropriate for their size and age. Some Affenpinschers may have food sensitivities or allergies, so it's important to pay attention to any negative reactions they may have to certain foods. Additionally, because of their small size and high energy levels, they may benefit from having their meals divided into smaller portions throughout the day to prevent digestive issues.",12,15
Afghan hound,DOG,"The Afghan Hound is a majestic and elegant breed with a regal appearance. They have a long, silky coat that comes in a variety of colors such as cream, red, black, and blue. They have a distinctive long, narrow head with a prominent topknot and flowing ears that frame their face. Their eyes are dark and almond-shaped, giving them a soulful expression. The Afghan Hound has a long, graceful neck and a deep chest, giving them a sleek and athletic appearance. They have a narrow waist and a curved tail that curls over their back. Overall, the Afghan Hound exudes a sense of grace and beauty with their flowing coat and striking features.","The Afghan Hound is known for its dignified and aloof nature. They are independent and strong-willed dogs, often displaying a sense of regal elegance. Despite their aloof demeanor, they are also known to be affectionate and loyal to their families. Afghan Hounds are intelligent and have a stubborn streak, requiring patient and consistent training. They are generally good with children and other pets, but may have a high prey drive due to their history as hunters. These dogs are also known for their high energy levels and require regular exercise to keep them happy and healthy. Overall, the Afghan Hound is a unique and majestic breed with a distinct personality.","The Afghan Hound is an ancient breed of dog that originated in the mountainous regions of Afghanistan. They were originally used by nomadic tribes for hunting large prey such as deer and leopards. The breed's unique appearance and elegant flowing coat helped protect them from the harsh weather conditions of the region.

The Afghan Hound was highly coveted by royalty and wealthy individuals in Afghanistan, leading to their popularity spreading to Europe and eventually to the United States. They were recognized by the American Kennel Club in 1926.

Known for their regal appearance and graceful demeanor, Afghan Hounds are considered one of the most aristocratic of all dog breeds. They are independent, aloof, and intelligent, with a strong prey drive and a natural instinct to chase small animals.

Today, Afghan Hounds are still used for hunting in some parts of the world, but they are primarily kept as companions and show dogs. Their striking appearance and unique personality continue to make them a popular choice for dog lovers around the world.","The Afghan Hound is a sighthound breed known for their elegant appearance and graceful movements. When it comes to their eating habits, Afghan Hounds are generally finicky eaters and may turn their nose up at certain foods. It is important to provide them with a balanced diet that meets their nutritional needs to maintain their health and wellbeing.

Afghan Hounds should be fed high-quality dog food that is appropriate for their age, size, and activity level. They should be fed twice a day to keep their energy levels up and prevent them from getting hungry between meals. It is important to monitor their weight and adjust their food intake accordingly to prevent obesity, which can lead to health problems.

Since Afghan Hounds have long flowing coats, it is important to ensure they have a diet rich in essential fatty acids to maintain the health and shine of their coat. Regular grooming and exercise are also important for keeping them healthy and happy. Overall, Afghan Hounds require a balanced diet, regular feeding schedule, and proper grooming to thrive.",12,14
African hunting dog,DOG,"The African hunting dog, also known as the African wild dog or painted wolf, is a medium-sized canid native to sub-Saharan Africa. They have a distinctive coat pattern with patches of black, white, and yellow fur arranged in a mottled or blotchy pattern. They have large rounded ears, long legs, and a bushy tail. Their bodies are slim and athletic, built for speed and endurance. African hunting dogs have a strong jaw and sharp teeth designed for hunting and tearing flesh. They are highly social animals that live in packs and are known for their excellent teamwork and communication skills during hunting.","The African hunting dog, also known as the African wild dog, is a highly social and cooperative breed. They are known for their incredible pack mentality and tight-knit family units. They are incredibly intelligent and have a complex communication system within their pack. They are extremely athletic and have incredible stamina, as they are built for chasing down prey over long distances. African hunting dogs are also known for their playful and energetic nature, always on the move and looking for their next adventure. They are also fiercely loyal to their pack members, showing great affection and care for one another. Overall, they are a unique and fascinating breed with a strong sense of teamwork and cooperation.","The African hunting dog, also known as the African wild dog or painted wolf, is a highly social and intelligent breed indigenous to sub-Saharan Africa. Believed to have originated around 2-3 million years ago, these dogs are considered one of the continent's most successful predators. They have a unique hunting strategy, working together in coordinated packs to chase down and exhaust prey.

Their distinctive coat, which is a mixture of yellow, black, white, and brown, serves as both camouflage and a means of identification within the pack. African hunting dogs are known for their excellent stamina and speed, capable of running at speeds of up to 37 miles per hour for extended periods.

Despite their hunting prowess, African hunting dogs face significant threats to their survival, including habitat loss, disease, and human-wildlife conflict. Their population has seen a drastic decline in recent years, with estimates suggesting fewer than 6,000 individuals remaining in the wild.

Conservation efforts are underway to protect the African hunting dog and their habitat, with organizations working to raise awareness and implement measures to safeguard the future of this unique and endangered breed. Through these initiatives, it is hoped that the African hunting dog will continue to roam the African savannas for generations to come.","African hunting dogs are primarily carnivorous, with a diet mainly consisting of meat. They are skilled hunters and feed on a variety of prey including antelopes, wildebeest, and smaller mammals. These dogs hunt in packs, using complex social strategies to work together to take down larger prey. They have a high metabolism and require a substantial amount of food to maintain their energy levels. In addition to meat, they may also consume some vegetation such as grasses or fruits. African hunting dogs are opportunistic feeders and will scavenge for food when necessary. They have a lean build and long legs which make them efficient hunters and capable of covering long distances in search of food.",10,12
Airedale,DOG,"The Airedale Terrier is a large, sturdy breed with a powerful and muscular build. They have a long, flat head with a  deep chest and a dense, wiry coat that is typically tan with a black saddle. Their ears are set high on the head and fold over, while their small, dark eyes have an intelligent and alert expression. Airedales have a long, straight tail that is typically docked in the show ring. They are known for their confident and fearless demeanor, as well as their keen hunting instincts and strong prey drive. Overall, the Airedale Terrier is a handsome and athletic breed that exudes a sense of strength and purpose.","The Airedale Terrier is a confident and intelligent breed known for their playful and outgoing nature. They are often described as courageous, loyal, and affectionate towards their owners, making them great family pets. Airedales are known for their independent streak and can be somewhat stubborn, so consistent training and socialization are important. They are highly energetic and require plenty of exercise to keep them happy and healthy. Airedales have a strong prey drive and may not always get along well with other pets, especially smaller animals. Overall, they are fun-loving, protective, and make great companions for active households.","The Airedale Terrier breed originated in the Aire Valley in Yorkshire, England during the mid-19th century. They were bred from a combination of the terrier and otterhound breeds to create a versatile and intelligent hunting dog. Airedales were used by hunters and farmers to catch vermin, hunt small game, and retrieve waterfowl. They were also employed by the police and military for their bravery, loyalty, and keen sense of smell.

The breed was officially recognized by the American Kennel Club in 1884 and quickly gained popularity in the United States as a family pet and working dog. Airedales were known for their strong prey drive, protective nature, and ability to excel in various canine sports and activities. They became famous for their roles in World War I as messenger dogs, guard dogs, and search and rescue dogs.

Today, Airedale Terriers are still cherished for their playful personalities, loyalty to their families, and adaptability to various living environments. They are considered a medium to large-sized breed with a distinctive wiry coat that requires regular grooming. Airedales remain popular as both companions and working dogs, known for their intelligence, trainability, and versatile skill set.","The Airedale Terrier is a breed known for being energetic and active, so they require a diet that provides them with the necessary nutrients to support their high energy levels. These dogs benefit from a balanced diet consisting of high-quality, protein-rich dog food. It is recommended to feed them a diet that is specifically formulated for medium to large breed dogs.

Airedales have a tendency to gain weight easily, so it is important to monitor their food intake and avoid overfeeding. It is best to feed them two meals a day rather than leaving food out all day for them to graze on. Treats should be given in moderation to prevent weight gain.

These dogs thrive on a diet that includes meat, carbohydrates, fruits, and vegetables. Fresh water should always be available to them to keep them hydrated throughout the day. Airedales may have specific dietary needs or allergies, so it is important to consult with a veterinarian to determine the best diet for your individual dog.",10,12
American Wirehair,DOG,"The American Wirehair is a medium-sized cat breed with a sturdy and muscular build. They typically weigh between 8-14 pounds and have a lifespan of 14-18 years. This breed is known for their distinctive wiry coat, which is dense and coarse with crimped hairs that stand out from the body. Their coat comes in a variety of colors and patterns, including tabby, solid, and bi-color. The American Wirehair has a round head with prominent cheekbones, large round eyes, and medium-sized ears that are slightly rounded at the tips. They have a sweet and gentle expression, and are known for their affectionate and playful nature.","The American Wirehair is known for being loyal, affectionate, and playful. They are a loving and devoted breed that forms strong bonds with their owners. They are also known for their intelligence and easy trainability, making them a great choice for both experienced and first-time dog owners. American Wirehairs are known for their unique coat, which is wiry and crimped, giving them a distinctive look. They are typically good with children and other pets, making them a great family companion. Overall, the American Wirehair is a friendly, sociable, and fun-loving breed that makes a great addition to any household.","The American Wirehair is a rare and unique breed of cat, not a breed of dog. The breed originated in the United States in the 1960s when a spontaneous genetic mutation occurred in a litter of farm cats in upstate New York. A male kitten named Council Rock Farm Adam was born with distinctive wiry fur that set him apart from his siblings.

Breeder Joan O'Shea recognized the potential of this new trait and began selectively breeding Adam to create the American Wirehair breed. The breed was officially recognized by the Cat Fanciers' Association in 1978.

American Wirehairs are known for their unique coat that is dense, wiry, and crimped. They come in a variety of colors and patterns and have a friendly and affectionate temperament. They are active and playful cats that enjoy interactive play and socializing with their human companions.

The American Wirehair breed has gained popularity among cat enthusiasts for their striking appearance and charming personality. They are considered a rare breed and are prized for their distinctive coat and friendly nature.","The American Wirehair is a breed of cats, not dogs. Nevertheless, their eating habits are relatively simple. Like most cats, they are obligate carnivores, meaning they require a diet high in animal protein. Feeding them a balanced diet of high-quality commercial cat food, preferably grain-free, is essential for their overall health. It is recommended to provide them with a mix of wet and dry food to ensure they are getting enough moisture in their diet. Portion control is important as they can easily overeat and become obese. Fresh water should be available at all times, and treats should be given in moderation. Monitoring their weight and adjusting their food intake as needed is also key to keeping them healthy.",14,18
American Staffordshire terrier,DOG,"The American Staffordshire Terrier is a medium to large-sized dog with a muscular and athletic build. They have a broad head with strong jaws, a deep chest, and a short coat that lies close to their body. Their coat can come in a variety of colors, including black, blue, red, and fawn, often with white markings. They have a confident and alert expression with round, dark eyes and rose or half-pricked ears. Their tail is usually docked, and they have a strong, smooth gait. Overall, the American Staffordshire Terrier exudes strength, agility, and grace.","The American Staffordshire Terrier is a bold, confident, and loyal breed known for their affectionate and playful nature. They are intelligent and eager to please, making them highly trainable. With proper socialization and training, they can be great family pets, known for their gentle and loving demeanor with children. However, they are also known for their protective instincts and can be wary of strangers, making them excellent guard dogs. They are highly energetic and require regular exercise to keep them happy and healthy. Overall, the American Staffordshire Terrier is a loving, loyal, and protective breed with a strong work ethic and a playful spirit.","The American Staffordshire Terrier, often referred to as the AmStaff, is a breed that originated in the United States in the 19th century. They were developed from a combination of bulldogs and terriers, specifically for the purposes of dog fighting and as general farm dogs. The breed was further refined for its strength, agility, and intelligence.

Originally known as the Staffordshire Terrier, the breed was officially recognized as the American Staffordshire Terrier by the American Kennel Club in 1936. The breed was bred to be loyal and courageous, with a strong protective instinct, making them excellent guard dogs and family companions.

Despite their origins in dog fighting, the American Staffordshire Terrier is now known for their friendly and affectionate nature towards their owners. They are highly intelligent and eager to please, making them easily trainable. With proper socialization and training, they can be excellent family pets.

While the breed's history may have a dark past, the American Staffordshire Terrier is now a beloved breed known for their loyalty, courage, and affection towards their human companions.","The American Staffordshire Terrier is a breed known for their high energy levels and strong muscular build. They require a diet that is rich in protein to support their muscle development. It is recommended to feed them a balanced diet of high-quality dog food that is specifically formulated for medium to large breeds.

It is important to monitor their food intake and avoid overfeeding, as they are prone to obesity. Regular exercise is also essential to keep them healthy and prevent weight gain.

Additionally, it is important to provide them with fresh water at all times to keep them hydrated. It is recommended to feed them two meals a day to prevent bloating or stomach issues.

Overall, the American Staffordshire Terrier is a breed that thrives on a balanced diet, regular exercise, and proper hydration to maintain their health and well-being.",12,16
Appenzeller,DOG,"The Appenzeller is a medium-sized breed of dog known for its striking tri-color coat. They have a strong and muscular build with a slightly elongated body. Their head is broad with a slightly rounded skull and medium-sized, dark eyes. The ears are medium-sized and triangular in shape, set high on the head. The Appenzeller has a strong neck and deep chest, giving them a powerful appearance. They have a thick, double coat with a dense undercoat and a harsh outer coat that is black with symmetrical tan and white markings on the face, chest, and legs. Overall, the Appenzeller is a handsome and well-balanced dog with a confident and alert expression.","The Appenzeller is a high-energy and intelligent breed with a bold and confident personality. They are fiercely loyal and protective of their family, making them excellent watchdogs. However, they can also be wary of strangers and may be aggressive towards other animals if not properly socialized. 

These dogs are known for their independent nature and may be stubborn at times, requiring a firm and consistent hand in training. They thrive on mental and physical stimulation and excel in activities such as agility, obedience, and herding. 

Despite their strong personality, Appenzellers are affectionate and loving towards their family members, forming strong bonds with their human companions. They require plenty of exercise and mental stimulation to prevent boredom and destructive behaviors. Overall, the Appenzeller is a loyal, intelligent, and energetic breed that thrives in an active and structured environment.","The Appenzeller Sennenhund, also known as the Appenzeller, is a breed of dog that originates from Switzerland. They are one of the four ancient Swiss Sennenhund breeds, which were used as working dogs on farms in the Appenzell region.

The breed has a long history of herding livestock, guarding property, and pulling carts. They are known for their intelligence, agility, and strong work ethic. Appenzellers are also known for their distinctive tri-color coat, which consists of black, brown, and white markings.

The exact origins of the breed are unclear, but it is believed that the Appenzeller Sennenhund is descended from the Molossus dogs that were brought to Switzerland by the Romans. Over time, these dogs were crossbred with local Swiss herding dogs to create the breed we know today.

The Appenzeller Sennenhund was officially recognized by the Swiss Kennel Club in 1916 and has since become a popular breed both in Switzerland and around the world. They are known for their loyal and protective nature, making them excellent family pets as well as working dogs.","The Appenzeller dog breed is known for its high energy levels and active nature, so it requires a diet that is rich in nutrients to support its energy needs. It is recommended to feed them high-quality commercial dog food that is specifically formulated for active breeds.

Appenzellers should be fed twice a day to help maintain a consistent energy level throughout the day. It is important to carefully monitor their food intake to prevent overeating, as they can be prone to obesity if they are not given proper portion control.

Additionally, treats should be given in moderation to avoid weight gain. Fresh water should always be available to keep them hydrated, especially during and after exercise.

Overall, a balanced diet with the right amount of proteins, fats, and carbohydrates is essential for maintaining the health and well-being of an Appenzeller dog.",12,15
