name,animal,description,personality,origin,eating_habits,life_esperance_bottom,life_esperance_top
American Bobtail,CAT,"The American Bobtail is a medium to large-sized cat with a muscular build and a distinct bobbed tail that is about 1/3 to 1/2 the length of a typical cat's tail. Their fur is medium to long in length, with a thick, water-resistant double coat that comes in a variety of colors and patterns. They have a broad, slightly wedge-shaped head with high cheekbones, large, expressive eyes, and tufted ears. The breed is known for their wild appearance, with a strong, athletic body and a confident, playful demeanor. Overall, the American Bobtail is a unique and striking cat breed with a distinctive look and charismatic personality.","The American Bobtail is a friendly, affectionate, and intelligent breed of cat. They are known for their playful nature and love to interact with their human companions. American Bobtails are highly adaptable and enjoy being a part of the family. They are not overly needy but will seek out attention and companionship from their owners. This breed is also known for their curiosity and love of exploring their environment. American Bobtails are often described as loyal and easygoing, making them a great addition to any household.","The American Bobtail is a unique breed of cat that originated in the United States in the 1960s. It is believed to be descended from a natural mutation that occurred in domestic cats, resulting in the distinctive bobbed tail that gives the breed its name. 

The breed was first recognized in the 1970s when a couple in Arizona discovered a short-tailed cat in their neighborhood and decided to breed it with a Siamese cat. The resulting kittens had the same short tail, leading to the development of the American Bobtail breed.

American Bobtails are known for their friendly and intelligent personalities, making them popular pets. They have a muscular build and a semi-long coat that can come in a variety of colors and patterns. Their most distinctive feature is their short, stubby tail that can range from 1-4 inches in length.

These cats are known for their playful and affectionate nature, making them good companions for families and individuals alike. They are also highly adaptable and can adjust well to different environments, making them well-suited for a variety of living situations.","The American Bobtail is a medium to large breed of cat known for their unique bobbed tail. When it comes to their eating habits, American Bobtails are typically moderate eaters with a hearty appetite. They are not particularly picky eaters and will usually enjoy a combination of wet and dry cat food. It is important to provide them with a balanced diet that is rich in protein and essential nutrients to support their overall health and well-being. American Bobtails are also known to be active and playful cats, so it is important to monitor their food intake to prevent them from becoming overweight. It is recommended to feed them small, frequent meals throughout the day to keep them satisfied and maintain a healthy weight. Additionally, providing fresh water at all times is essential to keep them hydrated.",11,15
American Shorthair,CAT,"The American Shorthair is a medium to large-sized cat with a sturdy build. They have a muscular body, rounded head, and medium to short coat that comes in a wide variety of colors and patterns. Their eyes are large, round, and wide set, giving them a friendly and expressive look. American Shorthairs have a broad chest, strong legs, and a thick, bushy tail. Overall, they have a balanced and symmetrical appearance with a sweet and gentle expression. Their ears are medium-sized and slightly rounded at the tips. The American Shorthair is known for its easy-going temperament and makes a great companion for families and individuals alike.","The American Shorthair is known for being a gentle, friendly, and easy-going cat breed. They are excellent companions for families, as they get along well with children and other pets. This breed is affectionate, but not overly demanding of attention, making them ideal for busy households. They are also independent and intelligent cats, with a playful and energetic side. American Shorthairs are known for their adaptability and can thrive in a variety of living situations. Overall, they are loving, loyal, and well-rounded cats that make great additions to any home.","The American Shorthair breed of cat has roots dating back to the arrival of European settlers in North America. These cats were brought to the New World to protect supplies and cargo from rodents. Over time, these working cats interbred with other breeds, creating a unique and adaptable breed known for their hunting skills and friendly demeanor.

The American Shorthair was officially recognized as a breed in the early 1900s and was originally known as the Domestic Shorthair. However, breeders began selectively breeding cats with certain characteristics, such as a sturdy build and a short, dense coat, leading to the development of the American Shorthair we know today.

These cats are known for their intelligence, playfulness, and easy-going nature, making them popular pets for families and individuals alike. They come in a variety of colors and patterns, with silver tabby being the most common. American Shorthairs are also known for their longevity and overall good health.

Overall, the American Shorthair is a beloved breed with a rich history that showcases their adaptability and versatility as both working cats and beloved companions.","American Shorthair cats are known for their healthy appetites and love of food. They are not picky eaters and will usually eat whatever is offered to them. This breed tends to have a tendency towards obesity, so it is important to monitor their food intake and ensure they are getting the appropriate amount of food for their size and weight. Feeding them a balanced diet of high-quality cat food is important to keep them healthy and prevent weight gain. It is recommended to feed them small, frequent meals throughout the day rather than one large meal to help regulate their metabolism. Water should always be available for them to stay hydrated. Additionally, treats should be given in moderation to avoid overfeeding.",15,20
Balinese,CAT,"The Balinese cat is a breed known for its striking appearance and elegant demeanor. They have a long, slender body with a svelte build and graceful movements. Their most notable feature is their silky, medium-length coat that drapes beautifully over their body, resembling a flowing ball gown. The coat comes in a variety of colors, but is typically seal, blue, chocolate, lilac, or cream. Their fur is fine and soft to the touch, with minimal shedding. The Balinese has striking almond-shaped eyes that are a brilliant blue color, giving them an exotic and enchanting look. They have a long, tapered tail that adds to their overall sense of elegance and sophistication. Overall, the Balinese cat radiates an aura of beauty and grace that is sure to capture the hearts of anyone who encounters them.","The Balinese cat is known for being affectionate, intelligent, and playful. These cats are extremely social and enjoy being around their human companions, often following them around the house or curling up in their laps. Balinese cats are also highly intelligent and curious, always eager to explore and interact with their environment. They are known for their vocal nature, often engaging in conversations with their owners using a variety of vocalizations. In addition, Balinese cats are graceful and elegant, with a sleek, svelte build and a long, luxurious coat that requires regular grooming. Overall, the Balinese cat is a loving and loyal companion that thrives on attention and affection from their human family members.","The Balinese cat breed originated in the 1950s in the United States. It was developed through selective breeding of Siamese cats to produce long-haired kittens with the same elegant body type and striking blue eyes. Despite its name, the Balinese has no actual connection to Bali; the name was chosen to evoke the image of grace and beauty associated with the Indonesian island. The breed quickly gained popularity for its intelligence, affectionate nature, and striking appearance. Balinese cats are known for their vocal and playful personalities, making them popular pets for families and individuals seeking a loving and interactive feline companion.","The Balinese cat is known for their slender body and elegant appearance. They have similar eating habits to other domestic cat breeds, requiring a balanced diet of high-quality cat food. It is important to provide them with the appropriate portion sizes based on their age, weight, and activity level to prevent obesity. 

Balinese cats are known to be active and playful, so it is important to provide them with opportunities for exercise to maintain a healthy weight. They should have access to fresh water at all times to help keep them hydrated. It is recommended to feed them two to three small meals a day to prevent overeating and to help regulate their metabolism.

It is important to monitor their weight and adjust their diet as needed to prevent health issues. Additionally, treats should be given in moderation to prevent weight gain. Overall, the Balinese cat's eating habits are similar to other domestic cat breeds and require a balanced diet and regular exercise to maintain their health and well-being.",12,16
Bengal,CAT,"The Bengal cat is a medium to large-sized breed with a muscular and athletic build. They have a sleek and shiny coat with a distinctive pattern of spots and rosettes that resemble that of a leopard. The coat colors can range from brown, silver, snow, or charcoal. Bengals have large, expressive eyes that are usually green or gold in color. They have prominent cheekbones, a straight nose, and wide-set ears with rounded tips. Their long and lean body is supported by strong legs, and they have a thick, bushy tail. Overall, Bengals have a wild and exotic appearance that sets them apart from other domestic cat breeds.","The Bengal cat is known for its energetic and playful nature. They are highly intelligent and curious, always on the lookout for new adventures. Bengals are extremely social and love attention from their human companions. They can be quite vocal and demanding, often seeking out interaction and playtime. Despite their wild appearance, Bengals are affectionate and loving towards their owners. They are known for their high energy levels and athleticism, making them great climbers and jumpers. Overall, Bengal cats are playful, lively, and full of personality.","The Bengal cat breed originated in the United States in the 1960s when a breeder named Jean Mill crossed a domestic cat with a wild Asian Leopard Cat. The goal was to create a breed with the striking appearance of a wild leopard but the temperament of a domestic cat. After several generations of careful breeding, the Bengal cat was officially recognized as a breed in the 1980s. Known for their unique marble or spotted coat patterns, muscular build, and energetic personality, Bengal cats quickly gained popularity among cat enthusiasts. They are now one of the most sought-after breeds due to their exotic appearance and playful nature.","Bengal cats are known for their high energy levels and athleticism, which means they require a diet rich in protein to support their active lifestyle. It is recommended to feed them a high-quality, meat-based diet to meet their nutritional needs. 

Bengals are also prone to obesity, so it is important to portion their food and avoid free-feeding. They should be fed small, frequent meals throughout the day to prevent overeating. 

Additionally, providing access to fresh water at all times is essential for a Bengal's health and well-being. Some Bengals may enjoy wet food as a treat, which can help keep them hydrated. 

Overall, a balanced diet, portion control, and access to fresh water are key components of a Bengal cat's eating habits to keep them healthy and happy.",12,16
Birman,CAT,"The Birman is a medium to large-sized cat breed known for their striking appearance. They have a long, muscular body with a broad chest and strong legs. The Birman's most distinctive feature is their striking blue almond-shaped eyes set in a sweet expression. They have a semi-long, silky coat that is typically cream-colored with color points on the ears, face, paws, and tail. The points can come in a variety of colors, including seal, blue, chocolate, lilac, and more. Their coat is relatively low shedding and requires regular grooming to prevent matting. Birmans are known for their friendly and gentle nature, making them great companions for families and individuals alike.","Birmans are known for their gentle and affectionate nature. They are loving and loyal companions who form strong bonds with their owners. They are sociable cats who enjoy being around people and are good with children and other pets. Birmans are intelligent and curious, often following their owners around the house to see what they are up to. They are not overly vocal, but are known to communicate with soft, melodious voices. Birmans are also playful and enjoy interactive toys and games. Overall, they are sweet and gentle cats who make wonderful companions for families and individuals alike.","The Birman breed of cat originates from Burma, now known as Myanmar, where they were considered to be sacred temple cats. According to legend, they were guardians of the temples and were believed to bring good fortune to those who owned them. The breed was first introduced to Europe in the early 20th century by a French couple who were gifted a pair of Birmans by a Burmese temple priest.

Birmans are known for their striking blue eyes, colorpoint coat, and white gloves on their paws, which are said to be a sign of their sacred origins. They are medium to large in size, with a muscular build and a luxurious, silky coat that is easy to care for. Birmans have a playful and affectionate nature, making them popular pets for families and singles alike.

The breed was officially recognized by cat registries in the mid-20th century and has since become one of the most popular and well-loved cat breeds in the world. Birmans are known for their sweet and gentle temperament, making them excellent companions for those looking for a loyal and loving feline friend.","Birmans are known for their affectionate nature and love for human companionship. They are medium to large-sized cats that require a balanced diet to maintain their health and well-being. Birmans should be fed high-quality cat food that is rich in protein and essential nutrients. It is important to monitor their food intake to prevent overeating, as they can be prone to obesity. Birmans may have a tendency to graze throughout the day, so it is recommended to feed them controlled portions at scheduled times to prevent overeating. They should always have access to fresh water. Additionally, Birmans may have a sensitive stomach, so it is important to introduce new foods gradually to prevent digestive issues. Overall, Birmans require a balanced diet, regular feeding schedule, and plenty of fresh water to maintain their health.",12,16
Bombay,CAT,"The Bombay cat is a small to medium-sized breed known for its sleek, black coat and muscular build. They have large, rounded eyes that are typically a striking copper or gold color. Their ears are wide-set and their nose is short and slightly upturned. Bombeys have a compact body with a short, straight back and a rounded head. They are known for their friendly and affectionate demeanor, often forming strong bonds with their human companions. This breed is considered highly intelligent and playful, making them great pets for families and individuals alike.","The Bombay cat is known for its sleek black coat and mesmerizing copper eyes. They are intelligent, affectionate, and social cats that form strong bonds with their owners. Bombay cats are known for their playful and curious nature, often seeking out new experiences and adventures. Despite their adventurous spirit, they are also quite laid-back and enjoy lounging around the house. They are typically good with children and other pets, making them a great addition to any family. Overall, Bombay cats are friendly, outgoing, and loving companions who enjoy being the center of attention.","The Bombay cat breed was developed in the 1950s by an American breeder named Nikki Horner. She wanted to create a cat that resembled a miniature black panther. Horner crossed a sable Burmese with a black American Shorthair to achieve this goal. The result was a sleek, black cat with copper-colored eyes.

The breed was officially recognized by the Cat Fanciers' Association in 1976. Bombays are known for their affectionate and playful nature, making them excellent companions for families. They have a medium-sized and muscular body, with a short coat that requires minimal grooming.

Overall, Bombay cats are a relatively new breed but have quickly gained popularity for their striking appearance and loving personalities.","The Bombay cat breed is known to have a hearty appetite and tends to eat more than other breeds. They are not picky eaters and enjoy a variety of foods but tend to prefer wet food over dry kibble. It's important to monitor their food intake to prevent obesity, as they are prone to overeating. It's recommended to feed them high-quality cat food with a good balance of protein, fats, and carbohydrates. They should be fed small, frequent meals throughout the day to prevent digestive issues. Additionally, fresh water should always be available for them to stay hydrated.",12,16
British Longhair,CAT,"The British Longhair cat is a large and sturdy breed with a muscular build. They have a round head with an almost flat forehead and a short, broad nose. Their ears are medium-sized, rounded at the tips, and set wide apart on the head. The eyes are large, round, and expressive, usually in shades of green or gold. The coat of the British Longhair is long, dense, and luxurious, with a thick undercoat and a soft, plush texture. They come in a variety of colors and patterns, including solid, tabby, and bicolor. Their tail is thick and slightly tapered at the end. Overall, the British Longhair is a strikingly beautiful and elegant cat breed.","The British Longhair is a breed known for its gentle and affectionate nature. These cats are typically friendly, sociable and enjoy being around their human companions. They are known for their calm demeanor and easy-going personality, making them great pets for families with children or other pets.

British Longhairs are intelligent and curious, often exploring their surroundings and investigating new things. Despite their playful nature, they are also content to lounge around the house and enjoy a relaxed lifestyle. They are not overly vocal, but will communicate their needs through subtle cues and body language.

These cats are known for forming strong bonds with their owners and are often described as loyal and devoted companions. They enjoy receiving attention and affection from their humans, and will often seek out cuddle sessions and lap time. Overall, the British Longhair is a sweet and loving breed that brings joy and companionship to any household.","The British Longhair breed originated in Britain in the mid-20th century as a result of crossing British Shorthairs with Persian cats. This breeding program aimed to create a cat with the friendly and laid-back personality of the British Shorthair but with a luxurious long coat. The resulting breed became known as the British Longhair, featuring a dense, silky coat that requires regular grooming to prevent mats and tangles.

Known for their affectionate and gentle nature, British Longhairs are great companions for families and individuals alike. They are intelligent and playful cats that enjoy interactive play and bonding with their human companions. British Longhairs are also adaptable and tend to get along well with other pets in the household.

Overall, the British Longhair is a beautiful and loving breed that continues to gain popularity among cat owners worldwide.","The British Longhair is a large and muscular breed of cat with a laid-back and gentle demeanor. They have a hearty appetite and enjoy eating multiple small meals throughout the day. It is important to provide them with a balanced diet that is high in protein to support their muscle growth and maintenance. They should have access to fresh water at all times to stay hydrated. Due to their more sedentary lifestyle, monitoring their portion sizes is essential to prevent obesity. Treats should be given in moderation to avoid weight gain. It is also recommended to feed them high-quality, grain-free cat food to support their overall health and well-being.",12,20
British Shorthair,CAT,"The British Shorthair is a medium to large-sized cat with a sturdy and muscular build. They have a round face with large round eyes and a short, broad nose. Their ears are small and rounded at the tips. The breed's most characteristic feature is its dense, plush coat, which comes in a wide variety of colors and patterns. The British Shorthair is known for its distinctively short, dense fur that is soft to the touch. This breed has a calm and easygoing temperament, making them great companions for families or single owners. Overall, the British Shorthair is a charming and elegant cat with a sweet expression and a gentle demeanor.","The British Shorthair is known for its affectionate and calm nature. These cats are independent and are not overly demanding of attention, but they do enjoy being around their human companions. They are friendly and sociable, getting along well with children and other pets. British Shorthairs are also known for their intelligence and adaptability, making them easy to train and live with. They are not overly vocal, preferring to communicate through purring or body language. Overall, the British Shorthair is a laid-back and loving breed that makes a great addition to any family.","The British Shorthair is one of the oldest and most recognizable cat breeds in the world. It originated in Britain, where it was developed as a working cat to help keep rodents under control in homes, farms, and ships. The breed can be traced back to the first century AD when Romans introduced domestic cats to Britain.

During the 19th century, British Shorthairs were crossed with Persian cats to improve their coat thickness and body type. This breeding program led to the development of the modern British Shorthair breed that we know today. The breed's popularity grew rapidly in the late 19th century when it was exhibited in cat shows.

The British Shorthair is known for its round face, dense coat, and compact body. They have a calm and affectionate temperament, making them excellent companion animals. The breed comes in a variety of colors and patterns, including blue, black, cream, and tabby. In 1871, the British Shorthair was officially recognized as a breed by the Cat Fanciers' Association.

Today, the British Shorthair is one of the most popular cat breeds in the world, known for its charming personality and distinctive appearance. They are beloved by many cat lovers for their easy-going nature and independent spirit.","British Shorthair cats are known for their hearty appetite and can sometimes tendency to overeat, so it is important to portion control their meals. They thrive on a high-quality, balanced diet that consists of a mix of wet and dry food to ensure they receive all necessary nutrients. Regular feeding schedules should be established to prevent obesity. Fresh water should always be available. Treats should be given sparingly to prevent weight gain. It is also important to monitor their weight and adjust their diet as needed to maintain a healthy body condition.",12,20
