name,animal,description,personality,origin,eating_habits,life_esperance_bottom,life_esperance_top
borzoi,DOG,"The Borzoi is a large, elegant breed of dog known for its long, slender body, graceful movements, and silky, flowing coat. They typically stand between 28-32 inches tall at the shoulder and weigh 60-105 pounds. Their long, narrow heads are adorned with small, dark eyes and high-set, expressive ears that hang close to the head. The Borzoi's coat comes in a variety of colors including white, black, fawn, and brindle, often with distinctive markings on the face and legs. Their deep chests and tucked-in abdomens give them a regal appearance, while their long, slender legs and arched necks contribute to their aristocratic bearing. Overall, the Borzoi is a striking and majestic breed known for its beauty and grace.","The Borzoi is a gentle and dignified breed with a quiet and reserved nature. They are known for their elegant appearance and graceful movement. Borzois are loyal and affectionate towards their family but can be aloof around strangers. They have a strong prey drive and love to chase small animals, so they should always be kept on a leash in unfenced areas. Borzois are intelligent and independent, which can make them somewhat stubborn to train. They require patient and consistent training methods. Overall, the Borzoi is a loving and noble breed that thrives in a calm and structured environment.","The Borzoi, also known as the Russian Wolfhound, is a breed of sighthound that originated in Russia. They were bred by Russian nobility in the 17th century to hunt wolves and other game in the open plains of Russia. The breed was developed by crossing Arabian Greyhounds with a long-haired Russian breed known as the Perchino Hound.

The Borzoi is known for its graceful appearance, long and slender body, and silky, flowing coat. They are a tall and elegant breed, with a narrow head, long neck, and deep chest. Borzois were highly valued by Russian royalty and were often given as gifts to foreign dignitaries.

Borzois were originally used as hunting dogs, chasing down game such as wolves, foxes, and hares. They have exceptional speed and endurance, making them ideal for hunting in the vast Russian steppes. In addition to hunting, Borzois were also used for coursing, lure coursing, and competitive racing.

Today, Borzois are popular as companion animals and show dogs. They are known for their gentle and affectionate nature, but can be independent and aloof with strangers. Borzois require regular exercise and a fenced yard to run and play in. They are a relatively healthy breed, but can be prone to certain genetic health issues such as heart problems and gastric torsion.

Overall, the Borzoi is a unique and majestic breed with a rich history as a hunting and companion dog in Russia. They are cherished for their beauty, grace, and loyalty by dog enthusiasts around the world.","The Borzoi is a sighthound breed known for their elegant appearance and graceful demeanor. In terms of eating habits, Borzois are typically moderate eaters and do not have a voracious appetite. They do well on a high-quality diet that is rich in protein and essential nutrients to support their active and muscular bodies.

Borzoi are known to be sensitive to certain foods and may have allergies or sensitivities to certain ingredients. It is important to feed them a balanced diet that is tailored to their individual needs and preferences. They may require smaller, more frequent meals throughout the day to prevent bloating or digestive issues.

Due to their deep chest and slim build, Borzoi are prone to gastric torsion (bloat), so it is important to avoid feeding them large meals all at once. It is recommended to feed them in a quiet and stress-free environment to prevent any issues with their digestion.

Overall, Borzois are a unique breed with specific dietary needs that should be carefully monitored to ensure they maintain optimal health and well-being.",9,14
boxer,DOG,"The Boxer is a medium to large-sized breed with a strong and muscular build. They have a square-shaped, broad head with a wrinkled forehead and distinctive jowls. Their muzzle is short and square, with a black mask that covers their face. Boxers have a deep chest and a sleek, athletic body that is well-proportioned and powerful.

Their coat is short and smooth, coming in a variety of colors including fawn, brindle, and white. Boxers often have white markings on their face, chest, and paws. They have a distinctive underbite, with their lower jaw protruding slightly in front of their upper jaw.

Boxers have dark, expressive eyes that convey intelligence and alertness. Their ears are set high on their head and can be cropped or left natural, standing erect and giving them an attentive and alert appearance.

Overall, Boxers are known for their friendly and playful demeanor, often described as enthusiastic and energetic. They are loyal and affectionate companions, known for their love of people and their protective nature towards their family.","Boxers are known for their playful, energetic, and loyal nature. They are intelligent and highly trainable, making them good companions for active individuals or families. Boxers are known for their love of play and affection towards their loved ones. They are also protective of their family members and make excellent guard dogs. However, they can be stubborn and require consistent training and socialization to ensure good behavior. Boxers thrive on attention and are known to be friendly and social with humans and other pets. They are known for their exuberant personalities and boundless energy, making them a delightful addition to any household.","The Boxer breed of dog originated in Germany in the late 19th century. They were developed by crossing the now-extinct Bullenbeisser breed with the English Bulldog. The goal was to create a strong and agile breed that could be used for hunting, guarding, and working on farms. 

Boxers quickly gained popularity for their intelligence, loyalty, and protective nature. They were also used as messenger dogs during World War I due to their courage and trainability. After the war, Boxers were brought to the United States, where they continued to gain popularity as family pets and working dogs.

Today, Boxers are known for their playful and energetic personalities, as well as their strong bond with their human families. They are also prized for their versatility, excelling in various dog sports and activities. With their distinctive square build, droopy jowls, and expressive faces, Boxers are beloved around the world as loving companions and loyal protectors.","Boxers are known for their hearty appetites and lively personalities. They are generally high-energy dogs that require a balanced diet to maintain their overall health and vitality. Boxers should be fed a high-quality, protein-rich diet that is specially formulated for their specific nutritional needs. 

Due to their muscular build and active nature, boxers may require more calories than other breeds, so it is important to monitor their food intake and adjust portions accordingly. It is recommended to feed boxers twice a day, dividing their daily portion into two meals to help prevent bloating and other digestive issues.

It is essential to provide fresh water at all times to keep boxers hydrated, especially during periods of exercise or hot weather. Treats should be given in moderation to avoid weight gain and maintain a healthy physique. Additionally, some boxers may have food sensitivities or allergies, so it is important to consult with a veterinarian if you suspect any issues with your dog's diet.",10,12
briard,DOG,"The Briard is a large and muscular herding dog with a distinctive long and coarse double coat that comes in various shades of solid colors including black, gray, tawny, and blue. They have a strong, rectangular-shaped body with a deep chest, broad shoulders, and a long neck. Briards have a unique, arched shape to their eyebrows which give them an expressive and intelligent look. They have a bushy tail that curls at the end and their ears are set high and hang down close to their head. Briards have a dignified and confident demeanor, with a lively and alert expression. They are known for their loyalty, intelligence, and protective nature.","The Briard is a loyal, intelligent, and protective breed of dog. Known for their independent nature and strong-willed personality, they are confident and self-assured. Briards are affectionate and playful with their family members, but they can be wary of strangers and may require time to warm up to new people. They are highly trainable and excel in obedience and agility activities. Briards are natural herders and have a strong desire to protect their loved ones, making them excellent watchdogs. They are also known for their distinctive long, shaggy coat that requires regular grooming to maintain. Overall, the Briard is a loving and devoted companion with a strong work ethic and a keen sense of loyalty.","The Briard is an ancient breed of dog that originated in France. It is believed to have been around for over 1,000 years, with its roots dating back to the 8th century. The breed was originally used as a herding dog, guarding livestock and guiding them through the French countryside.

Briards were also used during World War I to carry messages, search for wounded soldiers, and even detect mines. Their intelligence, loyalty, and versatility made them valuable assets to the French military.

The breed nearly faced extinction after both World Wars but was saved by dedicated breeders who worked to preserve and promote the Briard. Today, the Briard is primarily kept as a companion and family pet, known for its protective nature, affectionate personality, and devotion to its owners.

Briards are medium to large-sized dogs with a distinctive long, coarse coat that forms a beard and eyebrows, giving them a unique and regal appearance. They are intelligent, energetic, and require regular exercise and mental stimulation to prevent boredom and behavioral issues. Overall, the Briard is a versatile and loving breed that continues to be cherished by dog enthusiasts around the world.","The Briard is a medium to large breed known for its active and energetic nature. When it comes to eating habits, Briards typically have a healthy appetite and enjoy their meals. It is important to provide them with a balanced and nutritious diet to support their high energy levels. Briards should be fed quality dog food that is appropriate for their age, size, and activity level. It is recommended to feed them two meals a day to prevent overeating and obesity. Briards should also have access to fresh water at all times to stay hydrated. Additionally, treats can be given in moderation as rewards for good behavior or training. Overall, Briards are hearty eaters who thrive on a diet that meets their nutritional needs.",10,12
bull,DOG,"The Bull Terrier is a unique and muscular breed of dog with a strong, compact body and a distinctive egg-shaped head. They have a short, glossy coat that comes in a variety of colors including white, brindle, fawn, and black. Their eyes are small, triangular, and deeply set, giving them a piercing and intense gaze. The Bull Terrier's ears are small and erect, and they have a straight, powerful tail. Overall, they are a strong and agile breed known for their confident and fearless demeanor.","Bull Terriers are known for their charismatic and playful personalities. They are often described as strong-willed, energetic, and mischievous. Despite their muscular build, they are actually quite friendly and affectionate towards their owners. They are intelligent and loyal dogs that require consistent training and socialization from a young age. Bull Terriers can be protective of their families and may display a stubborn streak at times. However, with proper care and attention, they make excellent companions for active individuals or families. They are known for their clownish behavior and love to make their owners laugh with their goofy antics. Overall, Bull Terriers are lively and spirited dogs that thrive on interaction and attention from their human companions.","The Bull Terrier is a breed of dog that originated in England in the 19th century. It was originally bred for dog fighting and ratting, but over time it became more popular as a companion dog. The breed was developed by crossing Bulldogs with various terriers to create a dog that was strong, courageous, and tenacious. One of the most famous Bull Terriers was a dog named Lord Gladiator, who was known for his courage and ferocity in the dog fighting ring.

The Bull Terrier was officially recognized as a breed in 1887 by the English Kennel Club. It quickly gained popularity in England and soon spread to other countries. The breed was further refined by breeders, leading to the development of the modern Bull Terrier that we know today.

Bull Terriers are known for their distinctive egg-shaped heads and muscular bodies. They are energetic, playful, and loyal dogs that make excellent companions for active individuals and families. Despite their tough appearance, Bull Terriers are affectionate and enjoy being around people.

In conclusion, the Bull Terrier is a unique breed with a fascinating history that has evolved from its origins as a fighting dog to becoming a beloved family pet.","Bull terriers are known for their hearty appetites, so it is important to monitor their food intake to prevent obesity. They typically require a high-quality, balanced diet that is tailored to their age, activity level, and health status. Bull terriers should be fed twice a day to maintain stable blood sugar levels and prevent overeating. However, they are prone to food allergies, so it is important to avoid common allergens such as wheat, corn, and soy in their diet. Additionally, due to their tendency to gulp their food quickly, it is recommended to use slow feeder bowls or puzzle toys to promote healthy eating habits and prevent bloating. Finally, fresh water should always be available to keep them hydrated.",8,10
cairn,DOG,"The Cairn Terrier is a small to medium-sized dog with a sturdy and compact build. They typically stand between 9-13 inches tall at the shoulder and weigh around 13-18 pounds. Cairn Terriers have a dense double coat that is weather-resistant, with a wiry outer coat and a soft undercoat. The most common coat colors are shades of red, brindle, black, or cream.

Their head is broad with a strong, tapered muzzle and a black nose. They have small, dark eyes that are set wide apart and give them an intelligent and alert expression. Cairn Terriers have erect ears that are set on top of their head. Their tail is carried high and they have a confident and spirited demeanor.

Overall, the Cairn Terrier is a lively and spirited breed with a playful personality. They are known for their fearless nature and are often described as affectionate, loyal, and curious. They are a great choice for families looking for a small, energetic companion with a big personality.","Cairn terriers are known for their feisty and adventurous personality. They are independent and bold, with a lively and alert demeanor. These dogs are intelligent and can be mischievous at times, always keeping their owners on their toes. Cairns are also affectionate and loyal, forming strong bonds with their families. They have a strong prey drive and may chase after small animals, so proper training and socialization are important. Overall, cairn terriers are spunky, charming, and full of personality, making them a delightful companion for those looking for a lively and spirited pet.","The Cairn Terrier is believed to have originated in the Scottish Highlands, where they were used as working dogs to hunt vermin, primarily rats and other pests on farms. Their name comes from the piles of stones that marked burial sites or boundaries, where they would often find their prey. The breed's exact origins are unclear, but they are thought to be descendants of the Skye Terrier and West Highland White Terrier. Cairns were recognized as a distinct breed in the early 20th century and gained popularity due to their appearance in the popular film ""The Wizard of Oz"" as Toto. Today, Cairn Terriers are cherished as loyal and affectionate companions with a bold and energetic personality.","Cairn Terriers are known to have hearty appetites and can be prone to overeating if not monitored. It is recommended to feed them high-quality dog food that is appropriate for their age, size, and activity level. They should be fed small meals throughout the day to help prevent obesity. Cairn Terriers can also be prone to food allergies, so it is important to monitor their reaction to different ingredients and consult with a veterinarian if any issues arise. Additionally, it is important to provide plenty of fresh water at all times to keep them hydrated. Overall, Cairn Terriers are relatively easy to feed but do require portion control and a balanced diet to maintain their health.",13,15
chow,DOG,"The Chow Chow is a medium to large-sized breed with a sturdy and square build. They have a distinctive lion-like mane of thick fur around their neck and a dense double coat that can come in various colors such as red, black, blue, cinnamon, and cream. Their large, broad skull is matched with a short, wide muzzle and deep-set, almond-shaped eyes that give them a regal expression. Chow Chows have a straight back, deep chest, and a tail that curls over their back. They have a unique gait where they appear to almost prance as they walk. Overall, they have a strong and muscular appearance that exudes confidence and independence.","Chow Chows are known for their independent and aloof nature. They are fiercely loyal and protective of their family members, making them excellent guard dogs. However, they can be standoffish and wary of strangers, requiring proper socialization from a young age. Chow Chows are known for their strong-willed and stubborn demeanor, making them a challenge to train for inexperienced owners. They can be aloof and reserved with strangers but are loving and affectionate towards their family members. Chow Chows require consistent and firm leadership to prevent them from becoming dominant or aggressive. Despite their stoic appearance, Chow Chows have a playful and fun-loving side, enjoying interactive play and mental stimulation. Overall, Chow Chows are devoted companions for experienced owners who can provide them with boundaries and structure.","The Chow Chow is an ancient breed of dog that originated in China over 2,000 years ago. They were used for hunting, guarding, and pulling carts. The breed was also a favorite of Chinese nobility and was often kept as a companion and watchdog. 

Chow Chows were introduced to the Western world in the late 18th century, when they were brought back to Europe by merchants and sailors. They quickly gained popularity for their unique appearance and aloof demeanor. 

In the 20th century, Chow Chows were further popularized in the United States and other Western countries, appearing in movies, advertisements, and as pets for celebrities. Despite their popularity, Chow Chows remain a relatively rare breed, known for their distinctive appearance, blue-black tongue, and lion-like ruff.","Chow Chows are known to have a somewhat independent and stubborn nature when it comes to their eating habits. They are typically not big eaters and can be picky with their food. It is important to feed them a high-quality, balanced diet to ensure their overall health and well-being. 

Chow Chows should be fed a diet that is rich in protein, with a moderate amount of fat and carbohydrates. They can be prone to obesity, so it is important to monitor their food intake and avoid overfeeding. It is recommended to feed them two smaller meals a day rather than one large meal to help prevent bloating. 

Some Chow Chows may have food sensitivities or allergies, so it is important to pay attention to how they react to certain ingredients and adjust their diet accordingly. Additionally, it is important to provide them with fresh water at all times to keep them hydrated.",9,15
clumber,DOG,"The Clumber Spaniel is a large, heavy-boned dog with a distinctive appearance. They have a long, low-slung body with a deep chest and muscular build. The head is square and broad, with a pronounced stop and a slightly domed skull. They have a powerful jaw with a scissor bite and a deep muzzle. Their eyes are dark and slightly sunken, giving them a thoughtful expression.

The ears are broad and slightly feathered, hanging close to the cheeks. The coat is dense, straight, and silky, with feathering on the legs, chest, and tail. The most common coat color is white with lemon or orange markings, giving them a regal and elegant look.

Overall, the Clumber Spaniel has a dignified and noble appearance, with a calm and gentle demeanor. They are known for their intelligence, loyalty, and affectionate nature, making them excellent family pets and companions.","The Clumber Spaniel is known for its friendly, gentle, and loyal personality. They are calm and affectionate dogs that are great companions for families and children. They are intelligent and trainable, although they can be stubborn at times. Clumbers are generally good-natured and get along well with other pets. They are not very active dogs and prefer a relaxed and laid-back lifestyle. However, they still require regular exercise to keep them healthy and happy. Overall, the Clumber Spaniel is a loving and devoted breed that makes a wonderful addition to any household.","The Clumber Spaniel is believed to have originated in France in the 18th century, named after the Duc de Noailles' kennels at Clumber Park in Nottinghamshire, England. They were bred by the British aristocracy for hunting in dense cover, particularly for flushing out game birds. The breed is a cross between the Alpine Spaniel, the Basset Hound, and the St. Bernard. Clumbers were popular with British royalty, including Queen Victoria. The breed was recognized by the American Kennel Club in 1884. Clumber Spaniels are known for their gentle and affectionate nature, as well as their impressive hunting abilities. They are one of the heaviest and most solidly built of all spaniels, with a distinctive white coat and lemon or orange markings. Today, Clumber Spaniels are beloved family pets and competent working dogs.","Clumber spaniels are known to have hearty appetites and can be prone to obesity if not monitored closely. It is recommended to feed them high-quality, breed-specific dog food in measured portions to prevent overeating. Clumbers may also benefit from a diet that includes fresh fruits and vegetables as treats, and plenty of fresh water should always be available. It is important to establish a feeding schedule and stick to it to help maintain their healthy weight. Additionally, slow feeder bowls or puzzle toys can be used to help slow down their eating and prevent bloat.",10,12
